Origami: Folding Warps for Energy Efficient GPUs.	Mohammad Abdel-Majeed,Daniel Wong 0001,Justin Kuang,Murali Annavaram	10.1145/2925426.2926281
Variation Among Processors Under Turbo Boost in HPC Systems.	Bilge Acun,Phil Miller,Laxmikant V. Kalé	10.1145/2925426.2926289
Graph Prefetching Using Data Structure Knowledge.	Sam Ainsworth 0001,Timothy M. Jones 0001	10.1145/2925426.2926254
Balanced Hashing and Efficient GPU Sparse General Matrix-Matrix Multiplication.	Pham Nguyen Quang Anh,Rui Fan 0004,Yonggang Wen 0001	10.1145/2925426.2926273
Write-Aware Management of NVM-based Memory Extensions.	Amro Awad,Sergey Blagodurov,Yan Solihin	10.1145/2925426.2926284
CuMAS: Data Transfer Aware Multi-Application Scheduling for Shared GPUs.	Mehmet E. Belviranli,Farzad Khorasani,Laxmi N. Bhuyan,Rajiv Gupta 0001	10.1145/2925426.2926271
Fast Multiplication in Binary Fields on GPUs via Register Cache.	Eli Ben-Sasson,Matan Hamilis,Mark Silberstein,Eran Tromer	10.1145/2925426.2926259
Optimizing Sparse Matrix-Vector Multiplication for Large-Scale Data Analytics.	Daniele Buono,Fabrizio Petrini,Fabio Checconi,Xing Liu,Xinyu Que,Chris Long,Tai-Ching Tuan	10.1145/2925426.2926278
Simulation and Analysis Engine for Scale-Out Workloads.	Nadav Chachmon,Daniel Richins,Robert S. Cohn,Magnus Christensson,Wenzhi Cui,Vijay Janapa Reddi	10.1145/2925426.2926293
Runtime-Guided Mitigation of Manufacturing Variability in Power-Constrained Multi-Socket NUMA Nodes.	Dimitrios Chasapis,Marc Casas,Miquel Moretó,Martin Schulz 0001,Eduard Ayguadé,Jesús Labarta,Mateo Valero	10.1145/2925426.2926279
Coherence-Free Multiview: Enabling Reference-Discerning Data Placement on GPU.	Guoyang Chen,Xipeng Shen	10.1145/2925426.2926277
Exploiting Private Local Memories to Reduce the Opportunity Cost of Accelerator Integration.	Emilio G. Cota,Paolo Mantovani,Luca P. Carloni	10.1145/2925426.2926258
TokenTLB: A Token-Based Page Classification Approach.	Albert Esteve,Alberto Ros,Antonio Robles,María Engracia Gómez,José Duato	10.1145/2925426.2926280
Mini-Ckpts: Surviving OS Failures in Persistent Memory.	David Fiala,Frank Mueller 0001,Kurt B. Ferreira,Christian Engelmann	10.1145/2925426.2926295
Polly-ACC Transparent compilation to heterogeneous hardware.	Tobias Grosser,Torsten Hoefler	10.1145/2925426.2926286
HOPE: Enabling Efficient Service Orchestration in Software-Defined Data Centers.	Yang Hu 0001,Chao Li 0009,Longjun Liu,Tao Li 0006	10.1145/2925426.2926257
High Performance Design for HDFS with Byte-Addressability of NVM and RDMA.	Nusrat Sharmin Islam,Md. Wasi-ur-Rahman,Xiaoyi Lu,Dhabaleswar K. Panda 0001	10.1145/2925426.2926290
Reusing Data Reorganization for Efficient SIMD Parallelization of Adaptive Irregular Applications.	Peng Jiang 0004,Linchuan Chen,Gagan Agrawal	10.1145/2925426.2926285
Proteus: Exploiting Numerical Precision Variability in Deep Neural Networks.	Patrick Judd,Jorge Albericio,Tayler H. Hetherington,Tor M. Aamodt,Natalie D. Enright Jerger,Andreas Moshovos	10.1145/2925426.2926294
Fairness-oriented OS Scheduling Support for Multicore Systems.	Changdae Kim,Jaehyuk Huh	10.1145/2925426.2926262
Peruse and Profit: Estimating the Accelerability of Loops.	Snehasish Kumar,Vijayalakshmi Srinivasan,Amirali Sharifian,Nick Sumner,Arrvindh Shriraman	10.1145/2925426.2926269
Galaxyfly: A Novel Family of Flexible-Radix Low-Diameter Topologies for Large-Scales Interconnection Networks.	Fei Lei,Dezun Dong,Xiangke Liao,Xing Su,Cunlu Li	10.1145/2925426.2926275
Tag-Split Cache for Efficient GPGPU Cache Utilization.	Lingda Li,Ari B. Hayes,Shuaiwen Leon Song,Eddy Z. Zhang	10.1145/2925426.2926253
SFU-Driven Transparent Approximation Acceleration on GPUs.	Ang Li 0006,Shuaiwen Leon Song,Mark Wijtvliet,Akash Kumar 0001,Henk Corporaal	10.1145/2925426.2926255
Replichard: Towards Tradeoff between Consistency and Performance for Metadata.	Zhiying Li,Ruini Xue,Lixiang Ao	10.1145/2925426.2926292
Hybrid CPU-GPU scheduling and execution of tree traversals.	Jianqiao Liu,Nikhil Hegde,Milind Kulkarni 0001	10.1145/2925426.2926261
Towards an Adaptive Multi-Power-Source Datacenter.	Longjun Liu,Hongbin Sun 0001,Chao Li 0009,Yang Hu 0001,Nanning Zheng 0001,Tao Li 0006	10.1145/2925426.2926276
Barrier-Aware Warp Scheduling for Throughput Processors.	Yuxi Liu,Zhibin Yu 0001,Lieven Eeckhout,Vijay Janapa Reddi,Yingwei Luo,Xiaolin Wang 0001,Zhenlin Wang,Cheng-Zhong Xu 0001	10.1145/2925426.2926267
SARVAVID: A Domain Specific Language for Developing Scalable Computational Genomics Applications.	Kanak Mahadik,Christopher Wright,Jinyi Zhang,Milind Kulkarni 0001,Saurabh Bagchi,Somali Chaterji	10.1145/2925426.2926283
DSMR: A Parallel Algorithm for Single-Source Shortest Path Problem.	Saeed Maleki,Donald Nguyen,Andrew Lenharth,María Jesús Garzarán,David A. Padua,Keshav Pingali	10.1145/2925426.2926287
TurboTiling: Leveraging Prefetching to Boost Performance of Tiled Codes.	Sanyam Mehta,Rajat Garg,Nishad Trivedi,Pen-Chung Yew	10.1145/2925426.2926288
Lynx: Using OS and Hardware Support for Fast Fine-Grained Inter-Core Communication.	Konstantina Mitropoulou,Vasileios Porpodas,Xiaochun Zhang,Timothy M. Jones 0001	10.1145/2925426.2926274
Prefetching Techniques for Near-memory Throughput Processors.	Reena Panda,Yasuko Eckert,Nuwan Jayasena,Onur Kayiran,Michael Boyer,Lizy Kurian John	10.1145/2925426.2926282
SReplay: Deterministic Sub-Group Replay for One-Sided Communication.	Xuehai Qian,Koushik Sen,Paul Hargrove,Costin Iancu	10.1145/2925426.2926264
Exploiting Dynamic Reuse Probability to Manage Shared Last-level Caches in CPU-GPU Heterogeneous Processors.	Siddharth Rai,Mainak Chaudhuri	10.1145/2925426.2926266
AEQUITAS: Coordinated Energy Management Across Parallel Applications.	Haris Ribic,Yu David Liu	10.1145/2925426.2926260
Noise Aware Scheduling in Data Centers.	Hameedah Sultan,Arpit Katiyar,Smruti R. Sarangi	10.1145/2925426.2926268
Parallel Transposition of Sparse Data Structures.	Hao Wang 0002,Weifeng Liu 0002,Kaixi Hou,Wu-chun Feng	10.1145/2925426.2926291
BLASX: A High Performance Level-3 BLAS Library for Heterogeneous Multi-GPU Computing.	Linnan Wang,Wei Wu 0016,Zenglin Xu,Jianxiong Xiao,Yi Yang 0018	10.1145/2925426.2926256
GCaR: Garbage Collection aware Cache Management with Improved Performance for Flash-based SSDs.	Suzhen Wu,Yanping Lin,Bo Mao,Hong Jiang 0001	10.1145/2925426.2926263
Scheduling Tasks with Mixed Timing Constraints in GPU-Powered Real-Time Systems.	Yunlong Xu,Rui Wang 0014,Tao Li 0006,Mingcong Song,Lan Gao,Zhongzhi Luan,Depei Qian	10.1145/2925426.2926265
Efficient Timestamp-Based Cache Coherence Protocol for Many-Core Architectures.	Yuan Yao 0006,Guanhua Wang,Zhiguo Ge,Tulika Mitra,Wenzhi Chen,Naxin Zhang	10.1145/2925426.2926270
GreenGear: Leveraging and Managing Server Heterogeneity for Improving Energy Efficiency in Green Data Centers.	Xu Zhou,Haoran Cai,Qiang Cao 0001,Hong Jiang 0001,Lei Tian 0001,Changsheng Xie	10.1145/2925426.2926272
Proceedings of the 2016 International Conference on Supercomputing, ICS 2016, Istanbul, Turkey, June 1-3, 2016	Ozcan Ozturk 0001,Kemal Ebcioglu,Mahmut T. Kandemir,Onur Mutlu	
