FaaSnap: FaaS made fast using snapshot-based VMs.	Lixiang Ao,George Porter,Geoffrey M. Voelker	10.1145/3492321.3524270
A new benchmark harness for systematic and robust evaluation of streaming state stores.	Esmail Asyabi,Yuanli Wang,John Liagouris,Vasiliki Kalavri,Azer Bestavros	10.1145/3492321.3519592
Varuna: scalable, low-cost training of massive deep learning models.	Sanjith Athlur,Nitika Saran,Muthian Sivathanu,Ramachandran Ramjee,Nipun Kwatra	10.1145/3492321.3519584
Optimizing the interval-centric distributed computing model for temporal graph algorithms.	Animesh Baranawal,Yogesh Simmhan	10.1145/3492321.3519588
Performance evolution of mitigating transient execution attacks.	Jonathan Behrens,Adam Belay,M. Frans Kaashoek	10.1145/3492321.3519559
SafePM: a sanitizer for persistent memory.	Kartal Kaan Bozdogan,Dimitrios Stavrakakis,Shady Issa,Pramod Bhatotia	10.1145/3492321.3519574
Building an efficient key-value store in a flexible address space.	Chen Chen,Wenshao Zhong,Xingbo Wu	10.1145/3492321.3519555
DeepRest: deep resource estimation for interactive microservices.	Ka Ho Chow,Umesh Deshpande,Sangeetha Seshadri,Ling Liu 0001	10.1145/3492321.3519564
Narwhal and Tusk: a DAG-based mempool and efficient BFT consensus.	George Danezis,Lefteris Kokoris-Kogias,Alberto Sonnino,Alexander Spiegelman	10.1145/3492321.3519594
DAMYSUS: streamlined BFT consensus leveraging trusted components.	Jérémie Decouchant,David Kozhaya,Vincent Rahli,Jiangshan Yu	10.1145/3492321.3519568
Hardening binaries against more memory errors.	Gregory J. Duck,Yuntong Zhang 0002,Roland H. C. Yap	10.1145/3492321.3519580
D3: a dynamic deadline-driven approach for building autonomous vehicles.	Ionel Gog,Sukrit Kalra,Peter Schafhalter,Joseph E. Gonzalez,Ion Stoica	10.1145/3492321.3519576
Minimum viable device drivers for ARM trustzone.	Liwei Guo,Felix Xiaozhu Lin	10.1145/3492321.3519565
Beating the I/O bottleneck: a case for log-structured virtual disks.	Mohammad Hossein Hajkazemi,Vojtech Aschenbrenner,Mania Abdi,Emine Ugur Kaynar,Amin Mossayebzadeh,Orran Krieger,Peter Desnoyers	10.1145/3492321.3524271
KASLR in the age of MicroVMs.	Benjamin Holmes,Jason Waterman,Dan Williams	10.1145/3492321.3519578
Unicorn: reasoning about configurable system performance through the lens of causality.	Md Shahriar Iqbal,Rahul Krishna,Mohammad Ali Javidian,Baishakhi Ray,Pooyan Jamshidi	10.1145/3492321.3519575
APT-GET: profile-guided timely software prefetching.	Saba Jamilan,Tanvir Ahmed Khan,Grant Ayers,Baris Kasikci,Heiner Litz	10.1145/3492321.3519583
BetrFS: a compleat file system for commodity SSDs.	Yizheng Jiao,Simon Bertron,Sagar Patel,Luke Zeller,Rory Bennett,Nirjhar Mukherjee,Michael A. Bender,Michael Condict,Alex Conway,Martin Farach-Colton,Xiongzi Ge,William Jannen,Rob Johnson,Donald E. Porter,Jun Yuan 0006	10.1145/3492321.3519571
Jiffy: elastic far-memory for stateful serverless analytics.	Anurag Khandelwal,Yupeng Tang,Rachit Agarwal 0001,Aditya Akella,Ion Stoica	10.1145/3492321.3527539
ResPCT: fast checkpointing in non-volatile memory for multi-threaded applications.	Ana Khorguani,Thomas Ropars,Noel De Palma	10.1145/3492321.3519590
PKRU-safe: automatically locking down the heap between safe and unsafe languages.	Paul Kirth,Mitchel Dickerson,Stephen Crane,Per Larsen,Adrian Dabrowski,David Gens,Yeoul Na,Stijn Volckaert,Michael Franz	10.1145/3492321.3519582
Verified programs can party: optimizing kernel extensions via post-verification merging.	Hsuan-Chi Kuo,Kai-Hsun Chen,Yicheng Lu,Dan Williams,Sibin Mohan,Tianyin Xu	10.1145/3492321.3519562
OS scheduling with nest: keeping tasks close together on warm cores.	Julia Lawall,Himadri Chhaya-Shailesh,Jean-Pierre Lozi,Baptiste Lepers,Willy Zwaenepoel,Gilles Muller	10.1145/3492321.3519585
Improving scalability of database systems by reshaping user parallel I/O.	Ning Li,Hong Jiang 0001,Hao Che,Zhijun Wang 0001,Minh Q. Nguyen	10.1145/3492321.3519570
p2KVS: a portable 2-dimensional parallelizing framework to improve scalability of key-value stores on SSDs.	Ziyi Lu,Qiang Cao 0001,Hong Jiang 0001,Shucheng Wang,Yuanyuan Dong	10.1145/3492321.3519567
Multi-objective congestion control.	Yiqing Ma,Han Tian,Xudong Liao,Junxue Zhang 0001,Weiyan Wang,Kai Chen 0005,Xin Jin 0008	10.1145/3492321.3519593
Kite: lightweight critical service domains.	A. K. M. Fazla Mehrab,Ruslan Nikolaev 0001,Binoy Ravindran	10.1145/3492321.3519586
Out-of-order backprop: an effective scheduling technique for deep learning.	Hyungjun Oh,Junyeol Lee,HyeongJu Kim,Jiwon Seo 0002	10.1145/3492321.3519563
Hybrid anomaly detection and prioritization for network logs at cloud scale.	David Ohana,Bruno Wassermann,Nicolas Dupuis,Elliot K. Kolodner,Eran Raichstein,Michal Malka	10.1145/3492321.3519566
Memory deduplication for serverless computing with Medes.	Divyanshu Saxena,Tao Ji,Arjun Singhvi,Junaid Khalid,Aditya Akella	10.1145/3492321.3524272
Nyx-net: network fuzzing with incremental snapshots.	Sergej Schumilo,Cornelius Aschermann,Andrea Jemmett,Ali Abbasi 0002,Thorsten Holz	10.1145/3492321.3519591
Rolis: a software approach to efficiently replicating multi-core transactions.	Weihai Shen,Ansh Khanna,Sebastian Angel,Siddhartha Sen 0001,Shuai Mu 0001	10.1145/3492321.3519561
Fireworks: a fast, efficient, and safe serverless framework using VM-level post-JIT snapshot.	Wonseok Shin,Wook-Hee Kim,Changwoo Min	10.1145/3492321.3519581
State machine replication scalability made simple.	Chrysoula Stathakopoulou,Matej Pavlovic,Marko Vukolic	10.1145/3492321.3519579
VMSH: hypervisor-agnostic guest overlays for VMs.	Jörg Thalheim,Peter Okelmann,Harshavardhan Unnibhavi,Redha Gouicem,Pramod Bhatotia	10.1145/3492321.3519589
Tebis: index shipping for efficient replication in LSM key-value stores.	Michalis Vardoulakis,Giorgos Saloustros,Pilar González-Férez,Angelos Bilas	10.1145/3492321.3519572
Slashing the disaggregation tax in heterogeneous data centers with FractOS.	Lluís Vilanova,Lina Maudlej,Shai Bergman,Till Miemietz,Matthias Hille,Nils Asmussen,Michael Roitzsch,Hermann Härtig,Mark Silberstein	10.1145/3492321.3519569
Sharing is caring: secure and efficient shared memory support for MVEEs.	Jonas Vinck,Bert Abrath,Bart Coppens 0001,Alexios Voulimeneas,Bjorn De Sutter,Stijn Volckaert	10.1145/3492321.3519558
You shall not (by)pass!: practical, secure, and fast PKU-based sandboxing.	Alexios Voulimeneas,Jonas Vinck,Ruben Mechelinck,Stijn Volckaert	10.1145/3492321.3519560
Isolating functions at the hardware limit with virtines.	Nicholas C. Wanninger,Joshua J. Bowden,Kirtankumar Shetty,Ayush Garg 0007,Kyle C. Hale	10.1145/3492321.3519553
Characterizing the performance of intel optane persistent memory: a close look at its on-DIMM buffering.	Lingfeng Xiang,Xingsheng Zhao,Jia Rao,Song Jiang 0001,Hong Jiang 0001	10.1145/3492321.3519556
Fleche: an efficient GPU embedding cache for personalized recommendations.	Minhui Xie,Youyou Lu,Jiazhen Lin,Qing Wang 0031,Jian Gao,Kai Ren,Jiwu Shu	10.1145/3492321.3519554
LiteReconfig: cost and content aware reconfiguration of video object detection systems for mobile GPUs.	Ran Xu,Jayoung Lee,Pengcheng Wang,Saurabh Bagchi,Yin Li 0003,Somali Chaterji	10.1145/3492321.3519577
GNNLab: a factored system for sample-based GNN training over GPUs.	Jianbang Yang,Dahai Tang,Xiaoniu Song,Lei Wang,Qiang Yin 0002,Rong Chen 0001,Wenyuan Yu,Jingren Zhou	10.1145/3492321.3519557
OPEC: operation-based security isolation for bare-metal embedded systems.	Xia Zhou,Jiaqi Li,Wenlong Zhang,Yajin Zhou,Wenbo Shen,Kui Ren 0001	10.1145/3492321.3519573
EuroSys &apos;22: Seventeenth European Conference on Computer Systems, Rennes, France, April 5 - 8, 2022	Yérom-David Bromberg,Anne-Marie Kermarrec,Christos Kozyrakis	10.1145/3492321
