Error-controlled, progressive, and adaptable retrieval of scientific data with multilevel decomposition.	Xin Liang 0001,Qian Gong,Jieyang Chen,Ben Whitney,Lipeng Wan,Qing Liu 0002,David Pugmire,Rick Archibald,Norbert Podhorszki,Scott Klasky	10.1145/3458817.3476179
A next-generation discontinuous galerkin fluid dynamics solver with application to high-resolution lung airflow simulations.	Martin Kronbichler 0002,Niklas Fehn,Peter Munch,Maximilian Bergbauer,Karl-Robert Wichmann,Carolin Geitner,Momme Allalen,Martin Schulz 0001,Wolfgang A. Wall	10.1145/3458817.3476171
Chimera: efficiently training large-scale neural networks with bidirectional pipelines.	Shigang Li 0002,Torsten Hoefler	10.1145/3458817.3476145
LCCG: a locality-centric hardware accelerator for high throughput of concurrent graph processing.	Jin Zhao 0003,Yu Zhang 0027,Xiaofei Liao,Ligang He,Bingsheng He,Hai Jin 0001,Haikun Liu	10.1145/3458817.3480854
Pilgrim: scalable and (near) lossless MPI tracing.	Chen Wang 0004,Pavan Balaji,Marc Snir	10.1145/3458817.3476151
LMFF: efficient and scalable layered materials force field on heterogeneous many-core processors.	Ping Gao 0005,Xiaohui Duan,Jiaxu Guo,Jin Wang,Zhenya Song,Lizhen Cui,Xiangxu Meng,Xin Liu,Wusheng Zhang,Ming Ma,Guohui Li,Dexun Chen,Haohuan Fu,Wei Xue,Weiguo Liu,Guangwen Yang	10.1145/3458817.3476137
Discovering and balancing fundamental cycles in large signed graphs.	Ghadeer Alabandi,Jelena Tesic,Lucas Rusnak,Martin Burtscher	10.1145/3458817.3476153
The hidden cost of the edge: a performance comparison of edge and cloud latencies.	Ahmed Ali-Eldin,Bin Wang,Prashant J. Shenoy	10.1145/3458817.3476142
In-depth analyses of unified virtual memory system for GPU accelerated computing.	Tyler N. Allen,Rong Ge 0002	10.1145/3458817.3480855
Hybrid, scalable, trace-driven performance modeling of GPGPUs.	Yehia Arafa,Abdel-Hameed A. Badawy,Ammar ElWazir,Atanu Barai,Ali Eker,Gopinath Chennupati,Nandakishore Santhi,Stephan J. Eidenbenz	10.1145/3458817.3476221
Online optimization of file transfers in high-speed networks.	Md. Arifuzzaman,Engin Arslan	10.1145/3458817.3476208
Accelerating large scale de novo metagenome assembly using GPUs.	Muaaz Gul Awan,Steven A. Hofmeyr,Rob Egan,Nan Ding 0006,Aydin Buluç,Jack Deslippe,Leonid Oliker,Katherine A. Yelick	10.1145/3458817.3476212
Distributed multigrid neural solvers on megavoxel domains.	Aditya Balu,Sergio Botelho,Biswajit Khara,Vinay Rao,Soumik Sarkar,Chinmay Hegde,Adarsh Krishnamurthy,Santi Adavani,Baskar Ganapathysubramanian	10.1145/3458817.3476218
Enabling large-scale correlated electronic structure calculations: scaling the RI-MP2 method on summit.	Giuseppe M. J. Barca,Jorge L. Galvez Vallejo,David L. Poole,Melisa Alkan,Ryan Stocks,Alistair P. Rendell,Mark S. Gordon	10.1145/3458817.3476222
Generalizable coordination of large multiscale workflows: challenges and learnings at scale.	Harsh Bhatia,Francesco Di Natale,Joseph Y. Moon,Xiaohua Zhang,Joseph R. Chavez,Fikret Aydin,Christopher Stanley,Tomas Oppelstrup,Chris Neale,Sara Kokkila Schumacher,Dong H. Ahn,Stephen Herbein,Timothy S. Carpenter,Sandrasegaram Gnanakaran,Peer-Timo Bremer,James N. Glosli,Felice C. Lightstone,Helgi I. Ingólfsson	10.1145/3458817.3476210
Online evolutionary batch size orchestration for scheduling deep learning workloads in GPU clusters.	Zhengda Bian,Shenggui Li,Wei Wang,Yang You 0001	10.1145/3458817.3480859
FedAT: a high-performance and communication-efficient federated learning system with asynchronous tiers.	Zheng Chai,Yujing Chen,Ali Anwar 0001,Liang Zhao 0002,Yue Cheng 0001,Huzefa Rangwala	10.1145/3458817.3476211
Efficient scaling of dynamic graph neural networks.	Venkatesan T. Chakaravarthy,Shivmaran S. Pandian,Saurabh Raje,Yogish Sabharwal,Toyotaro Suzumura,Shashanka Ubaru	10.1145/3458817.3480858
E.T.: re-thinking self-attention for transformer models on GPUs.	Shiyang Chen,Shaoyi Huang,Santosh Pandey,Bingbing Li,Guang R. Gao,Long Zheng 0001,Caiwen Ding,Hang Liu 0001	10.1145/3458817.3476138
Efficient tensor core-based GPU kernels for structured sparsity under reduced precision.	Zhaodong Chen,Zheng Qu,Liu Liu 0017,Yufei Ding,Yuan Xie 0001	10.1145/3458817.3476182
Krill: a compiler and runtime system for concurrent graph processing.	Hongzheng Chen,Minghua Shen,Nong Xiao,Yutong Lu	10.1145/3458817.3476159
Scalable FBP decomposition for cone-beam CT reconstruction.	Peng Chen,Mohamed Wahib,Xiao Wang 0004,Takahiro Hirofuchi,Hirotaka Ogawa,Ander Biguri,Richard P. Boardman,Thomas Blumensath,Satoshi Matsuoka	10.1145/3458817.3476139
LogECMem: coupling erasure-coded in-memory key-value stores with parity logging.	Liangfeng Cheng,Yuchong Hu,Zhaokang Ke,Jia Xu,Qiaori Yao,Dan Feng 0001,Weichun Wang,Wei Chen	10.1145/3458817.3480852
Accelerating bandwidth-bound deep learning inference with main-memory accelerators.	Benjamin Y. Cho,Jeageun Jung,Mattan Erez	10.1145/3458817.3476146
Systematically inferring I/O performance variability by examining repetitive job behavior.	Emily Costa,Tirthak Patel,Benjamin Schwaller,Jim M. Brandt,Devesh Tiwari	10.1145/3458817.3476186
Enable simultaneous DNN services based on deterministic operator overlap and precise latency prediction.	Weihao Cui,Han Zhao 0005,Quan Chen 0002,Ningxin Zheng,Jingwen Leng,Jieru Zhao,Zhuo Song,Tao Ma,Yong Yang,Chao Li 0009,Minyi Guo	10.1145/3458817.3476143
Non-recurring engineering (NRE) best practices: a case study with the NERSC/NVIDIA OpenMP contract.	Christopher S. Daley,Annemarie Southwell,Rahulkumar Gayatri,Scott Biersdorfff,Craig Toepfer,Güray Özen,Nicholas J. Wright	10.1145/3458817.3476213
Clairvoyant prefetching for distributed machine learning I/O.	Nikoli Dryden,Roman Böhringer,Tal Ben-Nun,Torsten Hoefler	10.1145/3458817.3476181
Hardware-supported remote persistence for distributed persistent memory.	Zhuohui Duan,Haodi Lu,Haikun Liu,Xiaofei Liao,Hai Jin 0001,Yu Zhang 0027,Song Wu 0001	10.1145/3458817.3476194
AgEBO-tabular: joint neural architecture and hyperparameter search with autotuned data-parallel training for tabular data.	Romain Égelé,Prasanna Balaprakash,Isabelle Guyon,Venkatram Vishwanath,Fangfang Xia,Rick Stevens,Zhengying Liu	10.1145/3458817.3476203
APNN-TC: accelerating arbitrary precision neural networks on ampere GPU tensor cores.	Boyuan Feng,Yuke Wang,Tong Geng,Ang Li 0006,Yufei Ding	10.1145/3458817.3476157
Representation of women in HPC conferences.	Eitan Frachtenberg,Rhody D. Kaner	10.1145/3458817.3476164
EIGA: elastic and scalable dynamic graph analysis.	Kasimir Gabert,Kaan Sancak,M. Yusuf Özkaya,Ali Pinar,Ümit V. Çatalyürek	10.1145/3458817.3480857
Dr. Top-k: delegate-centric Top-k on GPUs.	Anil Gaihre,Da Zheng,Scott Weitze,Lingda Li,Shuaiwen Leon Song,Caiwen Ding,Xiaoye S. Li,Hang Liu 0001	10.1145/3458817.3476141
Tensor processing primitives: a programming abstraction for efficiency and portability in deep learning workloads.	Evangelos Georganas,Dhiraj D. Kalamkar,Sasikanth Avancha,Menachem Adelman,Cristina Anderson,Alexander Breuer,Jeremy Bruestle,Narendra Chaudhary,Abhisek Kundu,Denise Kutnick,Frank Laub,Vasimuddin Md,Sanchit Misra,Ramanarayan Mohanty,Hans Pabst,Barukh Ziv,Alexander Heinecke	10.1145/3458817.3476206
Linux vs. lightweight multi-kernels for high performance computing: experiences at pre-exascale.	Balazs Gerofi,Kohei Tarumizu,Lei Zhang,Takayuki Okamoto,Masamichi Takagi,Shinji Sumimoto,Yutaka Ishikawa	10.1145/3458817.3476162
Single-node partitioned-memory for huge graph analytics: cost and performance trade-offs.	Sayan Ghosh,Nathan R. Tallent,Marco Minutoli,Mahantesh Halappanavar,Ramesh Peri,Ananth Kalyanaraman	10.1145/3458817.3476156
FastZ: accelerating gapped whole genome alignment on GPUs.	Sree Charan Gundabolu,T. N. Vijaykumar,Mithuna Thottethodi	10.1145/3458817.3476202
Distributed quantum computing with QMPI.	Thomas Häner,Damian S. Steiger,Torsten Hoefler,Matthias Troyer	10.1145/3458817.3476172
Accelerating applications using edge tensor processing units.	Kuan-Chieh Hsu,Hung-Wei Tseng 0001	10.1145/3458817.3476177
Characterization and prediction of deep learning workloads in large-scale GPU datacenters.	Qinghao Hu,Peng Sun 0006,Shengen Yan,Yonggang Wen 0001,Tianwei Zhang 0004	10.1145/3458817.3476223
ndzip-gpu: efficient lossless compression of scientific floating-point data on GPUs.	Fabian Knorr,Peter Thoman,Thomas Fahringer	10.1145/3458817.3476224
Arithmetic-intensity-guided fault tolerance for neural network inference on GPUs.	Jack Kosaian,K. V. Rashmi	10.1145/3458817.3476184
3D acoustic-elastic coupling with gravity: the dynamics of the 2018 palu, sulawesi earthquake and tsunami.	Lukas Krenz,Carsten Uphoff,Thomas Ulrich,Alice-Agnes Gabriel,Lauren S. Abrahams,Eric M. Dunham,Michael Bader	10.1145/3458817.3476173
Cuttlefish: library for achieving energy efficiency in multicore parallel programs.	Sunil Kumar 0001,Akshat Gupta,Vivek Kumar 0001,Sridutt Bhalachandra	10.1145/3458817.3476163
CAKE: matrix multiplication using constant-bandwidth blocks.	H. T. Kung 0001,Vikas Natesh,Andrew Sabot	10.1145/3458817.3476166
On the parallel I/O optimality of linear algebra kernels: near-optimal matrix factorizations.	Grzegorz Kwasniewski,Marko Kabic,Tal Ben-Nun,Alexandros Nikolaos Ziogas,Jens Eirik Saethre,André Gaillard,Timo Schneider,Maciej Besta,Anton Kozhevnikov,Joost VandeVondele,Torsten Hoefler	10.1145/3458817.3476167
Resilient error-bounded lossy compressor for data transfer.	Sihuan Li,Sheng Di,Kai Zhao 0008,Xin Liang 0001,Zizhong Chen,Franck Cappello	10.1145/3458817.3476195
SV-sim: scalable PGAS-based state vector simulation of quantum circuits.	Ang Li 0006,Bo Fang,Christopher E. Granade,Guen Prawiroatmodjo,Bettina Heim,Martin Roetteler,Sriram Krishnamoorthy	10.1145/3458817.3476169
SW_Qsim: a minimize-memory quantum simulator with high-performance on a new Sunway supercomputer.	Fang Li,Xin Liu,Yong Liu,Pengpeng Zhao,Yuling Yang,Honghui Shang,Weizhe Sun,Zhen Wang,Enming Dong,Dexun Chen	10.1145/3458817.3476161
RIBBON: cost-effective and qos-aware deep learning model inference using a diverse pool of cloud computing instances.	Baolin Li,Rohan Basu Roy,Tirthak Patel,Vijay Gadepally,Karen Gettings,Devesh Tiwari	10.1145/3458817.3476168
HatRPC: hint-accelerated thrift RPC over RDMA.	Tianxi Li,Haiyang Shi,Xiaoyi Lu	10.1145/3458817.3476191
Reducing redundancy in data organization and arithmetic calculation for stencil computations.	Kun Li,Liang Yuan,Yunquan Zhang,Yue Yue	10.1145/3458817.3476154
STM-multifrontal QR: streaming task mapping multifrontal QR factorization empowered by GCN.	Shengle Lin,Wangdong Yang,Haotian Wang,Qinyun Tsai,Kenli Li 0001	10.1145/3458817.3476199
Closing the &quot;quantum supremacy&quot; gap: achieving real-time simulation of a random quantum circuit using a new Sunway supercomputer.	Yong (Alexander) Liu,Xin (Lucy) Liu,Fang (Nancy) Li,Haohuan Fu,Yuling Yang,Jiawei Song,Pengpeng Zhao,Zhen Wang,Dajia Peng,Huarong Chen,Chu Guo,Heliang Huang,Wenzhao Wu,Dexun Chen	10.1145/3458817.3487399
Meeting the real-time challenges of ground-based telescopes using low-rank matrix computations.	Hatem Ltaief,Jesse Cranney,Damien Gratadour,Yuxi Hong,Laurent Gatineau,David E. Keyes	10.1145/3458817.3476225
Paths to OpenMP in the kernel.	Jiacheng Ma,Wenyi Wang,Aaron Nelson,Michael Cuevas,Brian Homerding,Conghao Liu,Zhen Huang,Simone Campanoni,Kyle C. Hale,Peter A. Dinda	10.1145/3458817.3476183
BAASH: lightweight, efficient, and reliable blockchain-as-a-service for HPC systems.	Abdullah Al-Mamun 0001,Feng Yan 0001,Dongfang Zhao 0001	10.1145/3458817.3476155
DistGNN: scalable distributed training for large-scale graph neural networks.	Vasimuddin Md,Sanchit Misra,Guixiang Ma,Ramanarayan Mohanty,Evangelos Georganas,Alexander Heinecke,Dhiraj D. Kalamkar,Nesreen K. Ahmed,Sasikanth Avancha	10.1145/3458817.3480856
Hardware acceleration of tensor-structured multilevel ewald summation method on MDGRAPE-4A, a special-purpose computer system for molecular dynamics simulations.	Gentaro Morimoto,Yohei M. Koyama,Hao Zhang,Teruhisa S. Komatsu,Yousuke Ohno,Keigo Nishida,Itta Ohmura,Hiroshi Koyama,Makoto Taiji	10.1145/3458817.3476190
Reverse-mode automatic differentiation and optimization of GPU kernels via enzyme.	William S. Moses,Valentin Churavy,Ludger Paehler,Jan Hückelheim,Sri Hari Krishna Narayanan,Michel Schanen,Johannes Doerfert	10.1145/3458817.3476165
Simurgh: a fully decentralized and secure NVMM user space file system.	Nafiseh Moti,Frederic Schimmelpfennig,Reza Salkhordeh,David Klopp,Toni Cortes,Ulrich Rückert 0001,André Brinkmann	10.1145/3458817.3476180
Preparing an incompressible-flow fluid dynamics code for exascale-class wind energy simulations.	Paul Mullowney,Ruipeng Li,Stephen J. Thomas,Shreyas Ananthan,Ashesh Sharma,Jon S. Rood,Alan B. Williams,Michael A. Sprague	10.1145/3458817.3476185
Efficient large-scale language model training on GPU clusters using megatron-LM.	Deepak Narayanan,Mohammad Shoeybi,Jared Casper,Patrick LeGresley,Mostofa Patwary,Vijay Korthikanti,Dmitri Vainbrand,Prethvi Kashinkunti,Julie Bernauer,Bryan Catanzaro,Amar Phanishayee,Matei Zaharia	10.1145/3458817.3476209
Billion atom molecular dynamics simulations of carbon at extreme conditions and experimental time and length scales.	Kien Nguyen-Cong,Jonathan T. Willman,Stan G. Moore,Anatoly B. Belonoshko,Rahulkumar Gayatri,Evan Weinberg,Mitchell A. Wood,Aidan P. Thompson,Ivan I. Oleynik	10.1145/3458817.3487400
SEEC: stochastic escape express channel.	Mayank Parasar,Natalie D. Enright Jerger,Paul V. Gratz,Joshua San Miguel,Tushar Krishna	10.1145/3458817.3476140
HPAC: evaluating approximate computing techniques on HPC OpenMP applications.	Konstantinos Parasyris,Giorgis Georgakoudis,Harshitha Menon,James Diffenderfer,Ignacio Laguna,Daniel Osei-Kuffuor,Markus Schordan	10.1145/3458817.3476216
KAISA: an adaptive second-order optimizer framework for deep neural networks.	J. Gregory Pauloski,Qi Huang,Lei Huang 0019,Shivaram Venkataraman,Kyle Chard,Ian T. Foster,Zhao Zhang 0007	10.1145/3458817.3476152
Minimizing privilege for building HPC containers.	Reid Priedhorsky,Shane Richard Canon,Timothy Randles,Andrew J. Younge	10.1145/3458817.3476187
PEPPA-X: finding program test inputs to bound silent data corruption vulnerability in HPC applications.	Md Hasanur Rahman,Aabid Shamji,Shengjian Guo,Guanpeng Li	10.1145/3458817.3476147
ZeRO-infinity: breaking the GPU memory wall for extreme scale deep learning.	Samyam Rajbhandari,Olatunji Ruwase,Jeff Rasley,Shaden Smith,Yuxiong He	10.1145/3458817.3476205
MAPA: multi-accelerator pattern allocation policy for multi-tenant GPU servers.	Kiran Ranganath,Joshua D. Suetterlein,Joseph B. Manzano,Shuaiwen Leon Song,Daniel Wong 0001	10.1145/3458817.3480853
PAGANI: a parallel adaptive GPU algorithm for numerical integration.	Ioannis Sakiotis,Kamesh Arumugam,Marc F. Paterno,Desh Ranjan,Balsa Terzic,Mohammad Zubair	10.1145/3458817.3476198
Scalable adaptive PDE solvers in arbitrary domains.	Kumar Saurabh,Masado Ishii,Milinda Fernando,Boshun Gao,Kendrick Tan,Ming-Chen Hsu,Adarsh Krishnamurthy,Hari Sundar,Baskar Ganapathysubramanian	10.1145/3458817.3476220
High performance uncertainty quantification with parallelized multilevel Markov chain Monte Carlo.	Linus Seelinger,Anne Reinarz,Leonhard Rannabauer,Michael Bader,Peter Bastian,Robert Scheichl	10.1145/3458817.3476150
Flare: flexible in-network allreduce.	Daniele De Sensi,Salvatore Di Girolamo,Saleh Ashkboos,Shigang Li 0002,Torsten Hoefler	10.1145/3458817.3476178
TensorKMC: kinetic Monte Carlo simulation of 50 trillion atoms driven by deep learning on a new generation of Sunway supercomputer.	Honghui Shang,Xin Chen,Xingyu Gao,Rongfen Lin,Lifang Wang,Fang Li,Qian Xiao,Lei Xu 0023,Qiang Sun,Leilei Zhu,Fei Wang,Yunquan Zhang,Haifeng Song 0003	10.1145/3458817.3476174
Accelerating all-electron ab initio simulation of raman spectra for biological systems.	Honghui Shang,Fang Li,Yunquan Zhang,Ying Liu,Libo Zhang,Mingchuan Wu,Yangjun Wu,Di Wei,Huimin Cui,Xin Liu,Fei Wang,Yuxi Ye,Yingxiang Gao,Shuang Ni,Xin Chen 0023,Dexun Chen	10.1145/3458817.3476160
Extreme-scale ab initio quantum raman spectra simulations on the leadership HPC system in China.	Honghui Shang,Fang Li,Yunquan Zhang,Libo Zhang,You Fu,Yingxiang Gao,Yangjun Wu,Xiaohui Duan,Rongfen Lin,Xin Liu,Ying Liu,Dexun Chen	10.1145/3458817.3487402
Anton 3: twenty microseconds of molecular dynamics simulation before lunch.	David E. Shaw,Peter J. Adams,Asaph Azaria,Joseph A. Bank,Brannon Batson,Alistair Bell,Michael Bergdorf,Jhanvi Bhatt,J. Adam Butts,Timothy Correia,Robert M. Dirks,Ron O. Dror,Michael P. Eastwood,Bruce Edwards,Amos Even,Peter Feldmann,Michael Fenn,Christopher H. Fenton,Anthony Forte,Joseph Gagliardo,Gennette Gill,Maria Gorlatova,Brian Greskamp,J. P. Grossman,Justin Gullingsrud,Anissa Harper,William Hasenplaugh,Mark Heily,Benjamin Colin Heshmat,Jeremy Hunt,Douglas J. Ierardi,Lev Iserovich,Bryan L. Jackson,Nick P. Johnson,Mollie M. Kirk,John L. Klepeis,Jeffrey S. Kuskin,Kenneth M. Mackenzie,Roy J. Mader,Richard McGowen,Adam McLaughlin,Mark A. Moraes,Mohamed H. Nasr,Lawrence J. Nociolo,Lief O&apos;Donnell,Andrew Parker,Jon L. Peticolas,Goran Pocina,Cristian Predescu,Terry Quan,John K. Salmon,Carl Schwink,Keun Sup Shim,Naseer Siddique,Jochen Spengler,Tamas Szalay,Raymond Tabladillo,Reinhard Tartler,Andrew G. Taube,Michael Theobald,Brian Towles,William Vick,Stanley C. Wang,Michael Wazlowski,Madeleine J. Weingarten,John M. Williams,Kevin A. Yuh	10.1145/3458817.3487397
Revealing power, energy and thermal dynamics of a 200PF pre-exascale supercomputer.	Woong Shin,Vladyslav Oles,Ahmad Maroof Karimi,J. Austin Ellis,Feiyi Wang	10.1145/3458817.3476188
Bootstrapping in-situ workflow auto-tuning via combining performance models of component applications.	Tong Shu,Yanfei Guo,Justin M. Wozniak,Xiaoning Ding,Ian T. Foster,Tahsin M. Kurç	10.1145/3458817.3476197
Index launches: scalable, flexible representation of parallel task groups.	Rupanshu Soi,Michael Bauer 0001,Sean Treichler,Manolis Papadakis,Wonchan Lee,Patrick S. McCormick,Alex Aiken,Elliott Slaughter	10.1145/3458817.3476175
Parallel construction of module networks.	Ankit Srivastava,Sriram P. Chockalingam,Maneesha Aluru,Srinivas Aluru	10.1145/3458817.3476207
TriPoll: computing surveys of triangles in massive-scale temporal graphs with metadata.	Trevor Steil,Tahsin Reza,Keita Iwabuchi,Benjamin W. Priest,Geoffrey Sanders,Roger Pearce	10.1145/3458817.3476200
High-throughput virtual screening of small molecule inhibitors for SARS-CoV-2 protein targets with deep fusion models.	Garrett A. Stevenson,Derek Jones,Hyojin Kim,W. F. Drew Bennett,Brian J. Bennion,Monica Borucki,Feliza Bourguet,Aidan Epstein,Magdalena Franco,Brooke Harmon,Stewart He,Max P. Katz,Daniel A. Kirshner,Victoria Lao,Edmond Y. Lau,Jacky Lo,Kevin McLoughlin,Richard Mosesso,Deepa K. Murugesh,Oscar A. Negrete,Edwin A. Saada,Brent Segelke,Maxwell Stefan,Marisa W. Torres,Dina Weilhammer,Sergio E. Wong,Yue Yang,Adam T. Zemla,Xiaohua Zhang,Fangqiang Zhu,Felice C. Lightstone,Jonathan E. Allen	10.1145/3458817.3476193
Pinpointing crash-consistency bugs in the HPC I/O stack: a cross-layer approach.	Jinghan Sun,Jian Huang 0006,Marc Snir	10.1145/3458817.3476144
Whale: efficient one-to-many data partitioning in RDMA-assisted distributed stream processing systems.	Jie Tan,Hanhua Chen,Yonghui Wang,Hai Jin 0001	10.1145/3458817.3476192
Accelerating XOR-based erasure coding using program optimization techniques.	Yuya Uezato	10.1145/3458817.3476204
Lunule: an agile and judicious metadata load balancer for CephFS.	Yiduo Wang 0002,Cheng Li 0001,Xinyang Shao,Youxu Chen,Feng Yan 0001,Yinlong Xu	10.1145/3458817.3476196
Empirical evaluation of circuit approximations on noisy quantum devices.	Ellis Wilson,Frank Mueller 0001,Lindsay Bassman,Costin Iancu	10.1145/3458817.3476189
cuTS: scaling subgraph isomorphism on distributed multi-GPU systems using trie based data structure.	Lizhi Xiang,Arif Khan 0005,Edoardo Serra,Mahantesh Halappanavar,Aravind Sukumaran-Rajam	10.1145/3458817.3476214
Symplectic structure-preserving particle-in-cell whole-volume simulation of tokamak plasmas to 111.3 trillion particles and 25.7 billion grids.	Jianyuan Xiao,Junshi Chen,Jiangshan Zheng,Hong An,Shenghong Huang,Chao Yang,Fang Li,Ziyu Zhang,Yeqi Huang,Wenting Han,Xin Liu,Dexun Chen,Zixi Liu,Ge Zhuang,Jiale Chen,Guoqiang Li,Xuan Sun,Qiang Chen 0005	10.1145/3458817.3487398
LIBSHALOM: optimizing small and irregular-shaped matrix multiplications on ARMv8 multi-cores.	Weiling Yang,Jianbin Fang,Dezun Dong,Xing Su,Zheng Wang 0001	10.1145/3458817.3476217
A 400 trillion-grid Vlasov simulation on Fugaku supercomputer: large-scale distribution of cosmic relic neutrinos in a six-dimensional phase space.	Kohji Yoshikawa,Satoshi Tanaka,Naoki Yoshida	10.1145/3458817.3487401
Temporal vectorization for stencils.	Liang Yuan,Hang Cao,Yunquan Zhang,Kun Li,Pengqi Lu,Yue Yue	10.1145/3458817.3476149
G-SEPM: building an accurate and efficient soft error prediction model for GPGPUs.	Hengshan Yue,Xiaohui Wei,Guangli Li,Jianpeng Zhao,Nan Jiang,Jingweijia Tan	10.1145/3458817.3476170
Exploiting user activeness for data retention in HPC systems.	Wei Zhang 0097,Suren Byna,Hyogi Sim,Sangkeun Lee 0001,Sudharshan Vazhkudai,Yong Chen 0001	10.1145/3458817.3476201
Overcoming barriers to scalability in variational quantum Monte Carlo.	Tianchen Zhao,Saibal De,Brian Chen,James Stokes,Shravan K. Veerapaneni	10.1145/3458817.3476219
Understanding, predicting and scheduling serverless workloads under partial interference.	Laiping Zhao,Yanan Yang,Yiming Li,Xian Zhou,Keqiu Li	10.1145/3458817.3476215
DeltaFS: a scalable no-ground-truth filesystem for massively-parallel computing.	Qing Zheng,Charles D. Cranor,Gregory R. Ganger,Garth A. Gibson,George Amvrosiadis,Bradley W. Settlemyer,Gary A. Grider	10.1145/3458817.3476148
Enabling and scaling the HPCG benchmark on the newest generation Sunway supercomputer with 42 million heterogeneous cores.	Qianchao Zhu,Hao Luo,Chao Yang,Mingshuo Ding,Wanwang Yin,Xinhui Yuan	10.1145/3458817.3476158
Productivity, portability, performance: data-centric Python.	Alexandros Nikolaos Ziogas,Timo Schneider,Tal Ben-Nun,Alexandru Calotoiu,Tiziano De Matteis,Johannes de Fine Licht,Luca Lavarini,Torsten Hoefler	10.1145/3458817.3476176
Scalable edge-based hyperdimensional learning system with brain-like neural adaptation.	Zhuowen Zou,Yeseong Kim,Farhad Imani,Haleh Alimohamadi,Rosario Cammarota,Mohsen Imani	10.1145/3458817.3480958
International Conference for High Performance Computing, Networking, Storage and Analysis, SC 2021, St. Louis, Missouri, USA, November 14-19, 2021	Bronis R. de Supinski,Mary W. Hall,Todd Gamblin	10.1145/3458817
