Efficient and Scalable Graph Pattern Mining on GPUs.	Xuhao Chen 0001,Arvind	
Debugging the OmniTable Way.	Andrew Quinn 0001,Jason Flinn,Michael J. Cafarella,Baris Kasikci	
Carbink: Fault-Tolerant Far Memory.	Yang Zhou 0008,Hassan M. G. Wassel,Sihang Liu 0001,Jiaqi Gao,James Mickens,Minlan Yu,Chris Kennelly,Paul Turner,David E. Culler,Henry M. Levy,Amin Vahdat	
Automatic Reliability Testing For Cluster Management Controllers.	Xudong Sun 0013,Wenqing Luo,Jiawei Tyler Gu,Aishwarya Ganesan,Ramnatthan Alagappan,Michael Gasch,Lalith Suresh,Tianyin Xu	
Verifying Hardware Security Modules with Information-Preserving Refinement.	Anish Athalye,M. Frans Kaashoek,Nickolai Zeldovich	
Groove: Flexible Metadata-Private Messaging.	Ludovic Barman,Moshe Kol,David Lazar,Yossi Gilad,Nickolai Zeldovich	
Verifying the DaisyNFS concurrent and crash-safe file system with sequential reasoning.	Tej Chajed,Joseph Tassarotti,Mark Theng,M. Frans Kaashoek,Nickolai Zeldovich	
UPGRADVISOR: Early Adopting Dependency Updates Using Hybrid Program Analysis and Hardware Tracing.	Yaniv David,Xudong Sun 0013,Raphael J. Sofaer,Aditya Senthilnathan,Junfeng Yang,Zhiqiang Zuo 0002,Guoqing Harry Xu,Jason Nieh,Ronghui Gu	
TriCache: A User-Transparent Block Cache Enabling High-Performance Out-of-Core Processing with In-Memory Programs.	Guanyu Feng,Huanqi Cao,Xiaowei Zhu,Bowen Yu 0003,Yuanwei Wang,Zixuan Ma,Shengqi Chen 0001,Wenguang Chen	
Owl: Scale and Flexibility in Distribution of Hot Content.	Jason Flinn,Xianzheng Dou,Arushi Aggarwal,Alex Boyko,Francois Richard,Eric Sun,Wendy Tobagus,Nick Wolchko,Fang Zhou	
DURINN: Adversarial Memory and Thread Interleaving for Detecting Durable Linearizability Bugs.	Xinwei Fu,Dongyoon Lee,Changwoo Min	
Trinity: High-Performance Mobile Emulation through Graphics Projection.	Di Gao,Hao Lin 0005,Zhenhua Li 0001,Chengen Huang,Yunhao Liu 0001,Feng Qian 0001,Liangyi Gong,Tianyin Xu	
Jawa: Web Archival in the Era of JavaScript.	Ayush Goel,Jingyuan Zhu,Ravi Netravali,Harsha V. Madhyastha	
Microsecond-scale Preemption for Concurrent GPU-accelerated DNN Inferences.	Mingcong Han,Hanze Zhang,Rong Chen 0001,Haibo Chen 0001	
BlackBox: A Container Security Monitor for Protecting Containers on Untrusted Operating Systems.	Alexander Van&apos;t Hof,Jason Nieh	
Metastable Failures in the Wild.	Lexiang Huang,Matthew Magnusson,Abishek Bangalore Muralikrishna,Salman Estyak,Rebecca Isaacs,Abutalib Aghayev,Timothy Zhu,Aleksey Charapko	
KSplit: Automating Device Driver Isolation.	Yongzhe Huang,Vikram Narayanan,David Detweiler,Kaiming Huang,Gang Tan,Trent Jaeger,Anton Burtsev	
Operating System Support for Safe and Efficient Auxiliary Execution.	Yuzhuo Jing,Peng Huang 0005	
Tiger: Disk-Adaptive Redundancy Without Placement Restrictions.	Saurabh Kadekodi,Francisco Maturana,Sanjith Athlur,Arif Merchant,K. V. Rashmi,Gregory R. Ganger	
Practically Correct, Just-in-Time Shell Script Parallelization.	Konstantinos Kallas,Tammam Mustafa,Jan Bielak,Dimitris Karnikis,Thurston H. Y. Dang,Michael Greenberg 0002,Nikos Vasilakis	
ListDB: Union of Write-Ahead Logs and Persistent SkipLists for Incremental Checkpointing on Persistent Memory.	Wonbae Kim,Chanyeol Park,Dongui Kim,Hyeongjun Park,Young-ri Choi,Alan Sussman,Beomseok Nam	
Design and Verification of the Arm Confidential Compute Architecture.	Xupeng Li,Xuheng Li,Christoffer Dall,Ronghui Gu,Jason Nieh,Yousuf Sait,Gareth Stockwell	
RESIN: A Holistic Service for Dealing with Memory Leaks in Production Cloud Infrastructure.	Chang Lou,Cong Chen,Peng Huang 0005,Yingnong Dang,Si Qin,Xinsheng Yang,Xukun Li,Qingwei Lin,Murali Chintalapati	
Demystifying and Checking Silent Semantic Violations in Large Distributed Systems.	Chang Lou,Yuzhuo Jing,Peng Huang 0005	
Hubble: Performance Debugging with In-Production, Just-In-Time Method Tracing on Android.	Yu Luo,Kirk Rodrigues,Cuiqin Li,Feng Zhang,Lijin Jiang,Bing Xia,David Lion,Ding Yuan 0004	
Walle: An End-to-End, General-Purpose, and Large-Scale Production System for Device-Cloud Collaborative Machine Learning.	Chengfei Lv,Chaoyue Niu,Renjie Gu,Xiaotang Jiang,Zhaode Wang,Bin Liu,Ziqi Wu,Qiulin Yao,Congyu Huang,Panos Huang,Tao Huang,Hui Shu,Jinde Song,Bin Zou,Peng Lan,Guohuan Xu,Fei Wu,Shaojie Tang,Fan Wu 0006,Guihai Chen	
ORION and the Three Rights: Sizing, Bundling, and Prewarming for Serverless DAGs.	Ashraf Mahgoub,Edgardo Barsallo Yi,Karthick Shankar,Sameh Elnikety,Somali Chaterji,Saurabh Bagchi	
Looking Beyond GPUs for DNN Scheduling on Multi-Tenant Clusters.	Jayashree Mohan,Amar Phanishayee,Janardhan Kulkarni,Vijay Chidambaram	
Application-Informed Kernel Synchronization Primitives.	Sujin Park,Diyu Zhou,Yuchen Qian,Irina Calciu,Taesoo Kim,Sanidhya Kashyap	
BlockFlex: Enabling Storage Harvesting with Software-Defined Flash in Modern Cloud Platforms.	Benjamin Reidys,Jinghan Sun,Anirudh Badam,Shadi A. Noghabi,Jian Huang 0006	
From Dynamic Loading to Extensible Transformation: An Infrastructure for Dynamic Library Transformation.	Yuxin Ren,Kang Zhou,Jianhai Luan,Yunfeng Ye,Shiyuan Hu,Xu Wu,Wenqin Zheng,Wenfeng Zhang,Xinwei Hu	
CAP-VMs: Capability-Based Isolation and Sharing in the Cloud.	Vasily A. Sartakov,Lluís Vilanova,David M. Eyers,Takahiro Shinagawa,Peter R. Pietzuch	
Cancellation in Systems: An Empirical Study of Task Cancellation Patterns and Failures.	Utsav Sethi,Haochen Pan,Shan Lu 0001,Madanlal Musuvathi,Suman Nath	
Occualizer: Optimistic Concurrent Search Trees From Sequential Code.	Tomer Shanny,Adam Morrison 0001	
Ekko: A Large-Scale Deep Learning Recommender System with Low-Latency Model Update.	Chijun Sima,Yao Fu,Man-Kit Sit,Liyi Guo,Xuri Gong,Feng Lin,Junyu Wu,Yongsheng Li,Haidong Rong,Pierre-Louis Aublin,Luo Mai	
zIO: Accelerating IO-Intensive Applications with Transparent Zero-Copy IO.	Timothy Stamler,Deukyeon Hwang,Amanda Raybuck,Wei Zhang,Simon Peter 0001	
Unity: Accelerating DNN Training Through Joint Optimization of Algebraic Transformations and Parallelization.	Colin Unger,Zhihao Jia,Wei Wu 0016,Sina Lin,Mandeep Baines,Carlos Efrain Quintero Narvaez,Vinay Ramakrishnaiah,Nirmal Prajapati,Patrick S. McCormick,Jamaludin Mohd-Yusof,Xi Luo,Dheevatsa Mudigere,Jongsoo Park,Misha Smelyanskiy,Alex Aiken	
SHORTSTACK: Distributed, Fault-tolerant, Oblivious Data Access.	Midhul Vuppalapati,Kushal Babel,Anurag Khandelwal,Rachit Agarwal 0001	
MemLiner: Lining up Tracing and Application for a Far-Memory-Friendly Runtime.	Chenxi Wang,Haoran Ma,Shi Liu,Yifan Qiao,Jonathan Eyolfson,Christian Navasca,Shan Lu 0001,Guoqing Harry Xu	
DuoAI: Fast, Automated Inference of Inductive Invariants for Verifying Distributed Protocols.	Jianan Yao,Runzhou Tao,Ronghui Gu,Jason Nieh	
Immortal Threads: Multithreaded Event-driven Intermittent Computing on Ultra-Low-Power Microcontrollers.	Eren Yildiz,Lijun Chen,Kasim Sinan Yildirim	
Orca: A Distributed Serving System for Transformer-Based Generative Models.	Gyeong-In Yu,Joo Seong Jeong,Geon-Woo Kim,Soojeong Kim,Byung-Gon Chun	
FAERY: An FPGA-accelerated Embedding-based Retrieval System.	Chaoliang Zeng,Layong Luo,Qingsong Ning,Yaodong Han,Yuhang Jiang,Ding Tang,Zilong Wang,Kai Chen 0005,Chuanxiong Guo	
Blockaid: Data Access Policy Enforcement for Web Applications.	Wen Zhang,Eric Sheng,Michael Alan Chang,Aurojit Panda,Mooly Sagiv,Scott Shenker	
SparTA: Deep-Learning Model Sparsity via Tensor-with-Sparsity-Attribute.	Ningxin Zheng,Bin Lin,Quanlu Zhang,Lingxiao Ma,Yuqing Yang 0001,Fan Yang 0024,Yang Wang,Mao Yang,Lidong Zhou	
Alpa: Automating Inter- and Intra-Operator Parallelism for Distributed Deep Learning.	Lianmin Zheng,Zhuohan Li,Hao Zhang,Yonghao Zhuang,Zhifeng Chen,Yanping Huang,Yida Wang,Yuanzhong Xu,Danyang Zhuo,Eric P. Xing,Joseph E. Gonzalez,Ion Stoica	
XRP: In-Kernel Storage Functions with eBPF.	Yuhong Zhong,Haoyu Li,Yu Jian Wu,Ioannis Zarkadas,Jeffrey Tao,Evan Mesterhazy,Michael Makris,Junfeng Yang,Amy Tai,Ryan Stutsman,Asaf Cidon	
ODINFS: Scaling PM Performance with Opportunistic Delegation.	Diyu Zhou,Yuchen Qian,Vishal Gupta,Zhifei Yang,Changwoo Min,Sanidhya Kashyap	
ROLLER: Fast and Efficient Tensor Compilation for Deep Learning.	Hongyu Zhu,Ruofan Wu,Yijia Diao,Shanbin Ke,Haoyu Li,Chen Zhang,Jilong Xue,Lingxiao Ma,Yuqing Xia,Wei Cui,Fan Yang 0024,Mao Yang,Lidong Zhou,Asaf Cidon,Gennady Pekhimenko	
16th USENIX Symposium on Operating Systems Design and Implementation, OSDI 2022, Carlsbad, CA, USA, July 11-13, 2022	Marcos K. Aguilera,Hakim Weatherspoon	
