Identifying Use Case Elements from Textual Specification: A Preliminary Study.	Saurabh Tiwari 0001,Santosh Singh Rathore,Shreya Sagar,Yash Mirani	10.1109/RE48521.2020.00059
Towards Automatic Capturing of Traceability Links by Combining Eye Tracking and Interaction Data.	Maike Ahrens	10.1109/RE48521.2020.00064
Does our culture influence requirements engineering activities? Vietnamese practitioners&apos; view.	Tawfeeq Alsanoosy,Maria Spichkova,James Harland	10.1109/RE48521.2020.00054
On the Pragmatics of Requirements Engineering Practices in a Startup Ecosystem.	Carina Alves 0001,João Cunha,João Araújo 0001	10.1109/RE48521.2020.00041
Towards a Taxonomy for Eliciting Design-Operation Continuum Requirements of Cyber-Physical Systems.	Jon Ayerdi,Aitor Gartziandia,Aitor Arrieta,Wasif Afzal,Eduard Enoiu,Aitor Agirre,Goiuria Sagardui,Maite Arratibel,Ola Sellin	10.1109/RE48521.2020.00038
Inspectors Academy : Pedagogical Design for Requirements Inspection Training.	Muneera Bano,Didar Zowghi,Alessio Ferrari 0001,Paola Spoletini	10.1109/RE48521.2020.00032
How developers believe Invisibility impacts NFRs related to User Interaction.	Rainara Maia Carvalho,Rossana M. C. Andrade,Káthia M. de Oliveira	10.1109/RE48521.2020.00022
Theory as a Source of Software Requirements.	Ruzanna Chitchyan,Caroline Bird	10.1109/RE48521.2020.00033
Reducing Ambiguity in Requirements Elicitation via Gamification.	Hafsa Shareef Dar	10.1109/RE48521.2020.00065
Requirements engineering for moral considerations in algorithmic systems : RE&apos;20 Conference Keynote.	Francien Dechesne	10.1109/RE48521.2020.00010
Teaching Requirements Engineering for All: A Preliminary Report.	Alex Dekhtyar,Bruno da Silva 0002,Kason Slocum	10.1109/RE48521.2020.00050
Blockchain-oriented Requirements Engineering: A Framework.	Selina Demi	10.1109/RE48521.2020.00063
Requirements Dependency Extraction by Integrating Active Learning with Ontology-Based Retrieval.	Gouri Deshpande,Quim Motger,Cristina Palomares,Ikagarjot Kamra,Katarzyna Biesialska,Xavier Franch,Guenther Ruhe,Jason Ho	10.1109/RE48521.2020.00020
Requirements Management in Automotive: an Empirical Study on Process Improvement Areas.	Fabio Falcini,Giuseppe Lami	10.1109/RE48521.2020.00037
Towards Causality Extraction from Requirements.	Jannik Fischbach,Benedikt Hauptmann,Lukas Konwitschny,Dominik Spies,Andreas Vogelsang	10.1109/RE48521.2020.00053
The Way it Makes you Feel Predicting Users&apos; Engagement during Interviews with Biofeedback and Supervised Learning.	Daniela Girardi,Alessio Ferrari 0001,Nicole Novielli,Paola Spoletini,Davide Fucci,Thaide Huichapa	10.1109/RE48521.2020.00016
Automated Goal Model Extraction from User Stories Using NLP.	Tugçe Günes,Fatma Basak Aydemir	10.1109/RE48521.2020.00052
Cyber Digital Twin Simulator for Automatic Gathering and Prioritization of Security Controls&apos; Requirements.	Ethan Hadar,Dmitry Kravchenko,Alexander Basovskiy	10.1109/RE48521.2020.00035
NoRBERT: Transfer Learning for Requirements Classification.	Tobias Hey,Jan Keim,Anne Koziolek,Walter F. Tichy	10.1109/RE48521.2020.00028
Cutting through the Jungle: Disambiguating Model-based Traceability Terminology.	Jörg Holtmann,Jan-Philipp Steghöfer,Michael Rath 0002,David Schmelter	10.1109/RE48521.2020.00014
Evidence-driven Requirements Engineering for Uncertainty of Machine Learning-based Systems.	Fuyuki Ishikawa,Yutaka Matsuno	10.1109/RE48521.2020.00046
Security &amp; Safety by Model-based Requirements Engineering.	Sergej Japs	10.1109/RE48521.2020.00062
Towards socio-technical requirements engineering for regulatory compliance.	Oleksandr Kosenkov	10.1109/RE48521.2020.00067
RE @ runtime : the challenge of change RE&apos;20 Conference Keynote.	Jeff Kramer	10.1109/RE48521.2020.00012
Reaching the Unreachable : A Method for Early Stage Software Startups to Reach Inaccessible Stakeholders within Large Corporation.	Soo Ling Lim,Peter J. Bentley,Fuyuki Ishikawa	10.1109/RE48521.2020.00051
Towards Semantically Guided Traceability.	Yalin Liu,Jinfeng Lin,Qingkai Zeng 0001,Meng Jiang 0001,Jane Cleland-Huang	10.1109/RE48521.2020.00043
Ethics @ Scale: Governing Responsible Innovation in the Cloud RE&apos;20 Conference Keynote.	David Marcos	10.1109/RE48521.2020.00011
The Ten Lockheed Martin Cyber-Physical Challenges: Formalized, Analyzed, and Explained.	Anastasia Mavridou,Hamza Bourbouh,Dimitra Giannakopoulou,Thomas Pressburger,Mohammad Hejase,Pierre-Loïc Garoche,Johann Schumann	10.1109/RE48521.2020.00040
Requirements in the loop : A computer-aided analysis of consistency, completeness, and correctness of requirements.	Wolfgang Meincke	10.1109/RE48521.2020.00055
NERO: A Text-based Tool for Content Annotation and Detection of Smells in Feature Requests.	Fangwen Mu,Lin Shi 0006,Wei Zhou,Yuanzhong Zhang,Huixia Zhao	10.1109/RE48521.2020.00056
Requirements-Driven Method to Determine Quality Characteristics and Measurements for Machine Learning Software and Its Evaluation.	Koji Nakamichi,Kyoko Ohashi,Isao Namba,Rieko Yamamoto,Mikio Aoyama,Lisa Jöckel,Julien Siebert,Jens Heidrich	10.1109/RE48521.2020.00036
Same Same but Different: Finding Similar User Feedback Across Multiple Platforms and Languages.	Emanuel Oehri,Emitza Guzman	10.1109/RE48521.2020.00017
Requirements-Collector: Automating Requirements Specification from Elicitation Sessions and User Feedback.	Sebastiano Panichella,Marcela Ruiz	10.1109/RE48521.2020.00057
An Analysis of Requirements-Related Problems that Occurred in an organization Using a Mature Requirements Engineering Process.	Michael C. Panis	10.1109/RE48521.2020.00039
Towards the Specification and Verification of Legal Contracts.	Alireza Parvizimosaed	10.1109/RE48521.2020.00066
Continual Human Value Analysis in Software Development: A Goal Model Based Approach.	Harsha Perera,Gunter Mussbacher,Waqar Hussain,Rifat Ara Shams,Arif Nurwidyantoro,Jon Whittle 0001	10.1109/RE48521.2020.00030
ShapeRE: Towards a Multi-Dimensional Representation for Requirements of Sustainable Software.	Yen Dieu Pham,Abir Bouraffa,Walid Maalej	10.1109/RE48521.2020.00048
Quality Requirements Elicitation by Ideation of Product Quality Risks with Design Thinking.	Alexander Poth,Andreas Riel	10.1109/RE48521.2020.00034
Business Analysis Agility: how business analysis works with agile development RE&apos;20 Industry Day Keynote.	Suzanne Robertson	10.1109/RE48521.2020.00013
Extracting and Classifying Requirements from Software Engineering Contracts.	Abhishek Sainani,Preethu Rose Anish,Vivek Joshi,Smita Ghaisas	10.1109/RE48521.2020.00026
Towards Queryable and Traceable Domain Models.	Rijul Saini,Gunter Mussbacher,Jin L. C. Guo,Jörg Kienzle	10.1109/RE48521.2020.00044
Priority-Awareness of Non-Functional Requirements under Uncertainty.	Huma Samin	10.1109/RE48521.2020.00061
Trace Link Recovery using Semantic Relation Graphs and Spreading Activation.	Aaron Schlutter,Andreas Vogelsang	10.1109/RE48521.2020.00015
Symboleo: Towards a Specification Language for Legal Contracts.	Sepehr Sharifi,Alireza Parvizimosaed,Daniel Amyot,Luigi Logrippo,John Mylopoulos	10.1109/RE48521.2020.00049
Automated Recommendation of Templates for Legal Requirements.	Amin Sleimi,Marcello Ceci,Mehrdad Sabetzadeh,Lionel C. Briand,John Dann	10.1109/RE48521.2020.00027
Which App Features Are Being Used? Learning App Feature Usages from Interaction Data.	Christoph Stanik,Marlo Häring,Chakajkla Jesdabodi,Walid Maalej	10.1109/RE48521.2020.00019
Utilising Perspectives to Improve Completeness in Industrial Requirements Specifications.	Reinhard Stoiber	10.1109/RE48521.2020.00058
Voice of the Users: A Demographic Study of Software Feedback Behaviour.	James Tizard,Tim Rietz,Kelly Blincoe	10.1109/RE48521.2020.00018
An AI-assisted Approach for Checking the Completeness of Privacy Policies Against GDPR.	Damiano Torre,Sallam Abualhaija,Mehrdad Sabetzadeh,Lionel C. Briand,Katrien Baetens,Peter Goes,Sylvie Forastier	10.1109/RE48521.2020.00025
OASIS: Weakening User Obligations for Security-critical Systems.	Thein Than Tun,Amel Bennaceur,Bashar Nuseibeh	10.1109/RE48521.2020.00023
Digital Discrimination in Sharing Economy A Requirements Engineering Perspective.	Miroslav Tushev,Fahimeh Ebrahimi,Anas Mahmoud	10.1109/RE48521.2020.00031
Improving the Quality of Requirements in Middleware Requirements Specifications.	Vidyasagar Uddagiri,Lingachary Eswarachary,Manigandan Jagadeesan,Vishal Kharat	10.1109/RE48521.2020.00060
Early Requirements Traceability with Domain-Specific Taxonomies - A Pilot Experiment.	Michael Unterkalmsteiner	10.1109/RE48521.2020.00042
Towards a General Solution for Layout of Visual Goal Models with Actors.	Yilin Lucy Wang,Alicia M. Grubb	10.1109/RE48521.2020.00047
A Deep Context-wise Method for Coreference Detection in Natural Language Requirements.	Yawen Wang,Lin Shi 0006,Mingyang Li,Qing Wang 0001,Yun Yang 0001	10.1109/RE48521.2020.00029
The Lack of Shared Understanding of Non-Functional Requirements in Continuous Software Engineering: Accidental or Essential?	Colin M. Werner,Ze Shi Li,Neil A. Ernst,Daniela E. Damian	10.1109/RE48521.2020.00021
Data-driven Risk Management for Requirements Engineering: An Automated Approach based on Bayesian Networks.	Florian Wiesweg,Andreas Vogelsang,Daniel Méndez 0001	10.1109/RE48521.2020.00024
What Users Think about Predictive Analytics? A Survey on NFRs.	Jingwei Yang,Lin Liu	10.1109/RE48521.2020.00045
28th IEEE International Requirements Engineering Conference, RE 2020, Zurich, Switzerland, August 31 - September 4, 2020	Travis D. Breaux,Andrea Zisman,Samuel Fricker,Martin Glinz	
