Bias-variance tradeoffs in program analysis.	Rahul Sharma 0001,Aditya V. Nori,Alex Aiken	10.1145/2535838.2535853
Counter-factual typing for debugging type errors.	Sheng Chen 0008,Martin Erwig	10.1145/2535838.2535863
Optimal dynamic partial order reduction.	Parosh Aziz Abdulla,Stavros Aronis,Bengt Jonsson 0001,Konstantinos Sagonas	10.1145/2535838.2535845
A nonstandard standardization theorem.	Beniamino Accattoli,Eduardo Bonelli,Delia Kesner,Carlos Lombardi	10.1145/2535838.2535886
A verified information-flow architecture.	Arthur Azevedo de Amorim,Nathan Collins,André DeHon,Delphine Demange,Catalin Hritcu,David Pichardie,Benjamin C. Pierce,Randy Pollack,Andrew Tolmach	10.1145/2535838.2535839
NetkAT: semantic foundations for networks.	Carolyn Jane Anderson,Nate Foster,Arjun Guha,Jean-Baptiste Jeannin,Dexter Kozen,Cole Schlesinger,David Walker	10.1145/2535838.2535862
From parametricity to conservation laws, via Noether&apos;s theorem.	Robert Atkey	10.1145/2535838.2535867
A relationally parametric model of dependent type theory.	Robert Atkey,Neil Ghani,Patricia Johann	10.1145/2535838.2535852
Probabilistic relational verification for cryptographic implementations.	Gilles Barthe,Cédric Fournet,Benjamin Grégoire,Pierre-Yves Strub,Nikhil Swamy,Santiago Zanella Béguelin	10.1145/2535838.2535847
Abstract effects and proof-relevant logical relations.	Nick Benton,Martin Hofmann 0001,Vivek Nigam	10.1145/2535838.2535869
A constraint-based approach to solving games on infinite graphs.	Tewodros A. Beyene,Swarat Chaudhuri,Corneliu Popeea,Andrey Rybalchenko	10.1145/2535838.2535860
Modular reasoning about concurrent higher-order imperative programs.	Lars Birkedal	10.1145/2535838.2537849
A trusted mechanised JavaScript specification.	Martin Bodin,Arthur Charguéraud,Daniele Filaretti,Philippa Gardner,Sergio Maffeis,Daiva Naudziuniene,Alan Schmitt,Gareth Smith	10.1145/2535838.2535876
Battery transition systems.	Udi Boker,Thomas A. Henzinger,Arjun Radhakrishna	10.1145/2535838.2535875
Verifying eventual consistency of optimistic replication systems.	Ahmed Bouajjani,Constantin Enea,Jad Hamza	10.1145/2535838.2535877
The essence of Reynolds.	Stephen Brookes,Peter W. O&apos;Hearn,Uday S. Reddy	10.1145/2535838.2537851
Parametric completeness for separation theories.	James Brotherston,Jules Villard	10.1145/2535838.2535844
Replicated data types: specification, verification, optimality.	Sebastian Burckhardt,Alexey Gotsman,Hongseok Yang,Marek Zawirski	10.1145/2535838.2535848
Combining proofs and programs in a dependently typed language.	Chris Casinghino,Vilhelm Sjöberg,Stephanie Weirich	10.1145/2535838.2535883
Polymorphic functions with set-theoretic types: part 1: syntax, semantics, and evaluation.	Giuseppe Castagna,Kim Nguyen 0001,Zhiwu Xu 0001,Hyeonseung Im,Sergueï Lenglet,Luca Padovani	10.1145/2535838.2535840
Fair reactive programming.	Andrew Cave,Francisco Ferreira 0001,Prakash Panangaden,Brigitte Pientka	10.1145/2535838.2535881
Profiling for laziness.	Stephen Chang 0001,Matthias Felleisen	10.1145/2535838.2535887
Bridging boolean and quantitative synthesis using smoothed proof search.	Swarat Chaudhuri,Martin Clochard,Armando Solar-Lezama	10.1145/2535838.2535859
Consistency analysis of decision-making programs.	Swarat Chaudhuri,Azadeh Farzan,Zachary Kincaid	10.1145/2535838.2535858
A sound and complete abstraction for reasoning about parallel prefix sums.	Nathan Chong,Alastair F. Donaldson,Jeroen Ketema	10.1145/2535838.2535882
Fissile type analysis: modular checking of almost everywhere invariants.	Devin Coughlin,Bor-Yuh Evan Chang	10.1145/2535838.2535855
A Galois connection calculus for abstract interpretation.	Patrick Cousot,Radhia Cousot	10.1145/2535838.2537850
Minimization of symbolic automata.	Loris D&apos;Antoni,Margus Veanes	10.1145/2535838.2535849
Abstract satisfaction.	Vijay Victor D&apos;Silva,Leopold Haller,Daniel Kroening	10.1145/2535838.2535868
Sound compilation of reals.	Eva Darulova,Viktor Kuncak	10.1145/2535838.2535874
Tracing compilation by abstract interpretation.	Stefano Dissegna,Francesco Logozzo,Francesco Ranzato	10.1145/2535838.2535866
Probabilistic coherence spaces are fully abstract for probabilistic PCF.	Thomas Ehrhard,Christine Tasson,Michele Pagani	10.1145/2535838.2535865
Closed type families with overlapping equations.	Richard A. Eisenberg,Dimitrios Vytiniotis,Simon L. Peyton Jones,Stephanie Weirich	10.1145/2535838.2535856
Proofs that count.	Azadeh Farzan,Zachary Kincaid,Andreas Podelski	10.1145/2535838.2535885
Tabular: a schema-driven probabilistic programming language.	Andrew D. Gordon 0001,Thore Graepel,Nicolas Rolland,Claudio V. Russo,Johannes Borgström,John Guiver	10.1145/2535838.2535850
Proof search for propositional abstract separation logics via labelled sequents.	Zhe Hou,Ranald Clouston,Rajeev Goré,Alwen Tiu	10.1145/2535838.2535864
30 years of research and development around Coq.	Gérard P. Huet,Hugo Herbelin	10.1145/2535838.2537848
Modular reasoning about heap paths via effectively propositional formulas.	Shachar Itzhaky,Anindya Banerjee 0001,Neil Immerman,Ori Lahav,Aleksandar Nanevski,Mooly Sagiv	10.1145/2535838.2535854
Abstract acceleration of general linear loops.	Bertrand Jeannet,Peter Schrammel,Sriram Sankaranarayanan 0001	10.1145/2535838.2535843
Parametric effect monads and semantics of effect systems.	Shin-ya Katsumata	10.1145/2535838.2535846
Backpack: retrofitting Haskell with interfaces.	Scott Kilpatrick,Derek Dreyer,Simon L. Peyton Jones,Simon Marlow	10.1145/2535838.2535884
An operational and axiomatic semantics for non-determinism and sequence points in C.	Robbert Krebbers	10.1145/2535838.2535878
CakeML: a verified implementation of ML.	Ramana Kumar,Magnus O. Myreen,Michael Norrish,Scott Owens	10.1145/2535838.2535841
Freeze after writing: quasi-deterministic parallel programming with LVars.	Lindsey Kuper,Aaron Turon,Neelakantan R. Krishnaswami,Ryan R. Newton	10.1145/2535838.2535842
On coinductive equivalences for higher-order probabilistic functional programs.	Ugo Dal Lago,Davide Sangiorgi,Michele Alberti	10.1145/2535838.2535872
A proof system for separation logic with magic wand.	Wonyeol Lee 0001,Sungwoo Park	10.1145/2535838.2535871
Symbolic optimization with SMT solvers.	Yi Li 0008,Aws Albarghouthi,Zachary Kincaid,Arie Gurfinkel,Marsha Chechik	10.1145/2535838.2535857
Sound input filter generation for integer overflow errors.	Fan Long,Stelios Sidiroglou-Douskos,Deokhwan Kim,Martin C. Rinard	10.1145/2535838.2535888
Authenticated data structures, generically.	Andrew Miller 0001,Michael Hicks 0001,Jonathan Katz,Elaine Shi	10.1145/2535838.2535851
Game semantics for interface middleweight Java.	Andrzej S. Murawski,Nikos Tzevelekos	10.1145/2535838.2535880
Applying quantitative semantics to higher-order quantum computing.	Michele Pagani,Peter Selinger,Benoît Valiron	10.1145/2535838.2535879
A type-directed abstraction refinement approach to higher-order model checking.	Steven J. Ramsay,Robin P. Neatherway,C.-H. Luke Ong	10.1145/2535838.2535873
Modular, higher-order cardinality analysis in theory and practice.	Ilya Sergey,Dimitrios Vytiniotis,Simon L. Peyton Jones	10.1145/2535838.2535861
Gradual typing embedded securely in JavaScript.	Nikhil Swamy,Cédric Fournet,Aseem Rastogi,Karthikeyan Bhargavan,Juan Chen 0002,Pierre-Yves Strub,Gavin M. Bierman	10.1145/2535838.2535889
Toward general diagnosis of static errors.	Danfeng Zhang,Andrew C. Myers	10.1145/2535838.2535870
The 41st Annual ACM SIGPLAN-SIGACT Symposium on Principles of Programming Languages, POPL &apos;14, San Diego, CA, USA, January 20-21, 2014	Suresh Jagannathan,Peter Sewell	10.1145/2535838
