DSI: an evidence-based approach to identify dynamic data structures in C programs.	David H. White 0001,Thomas Rupprecht,Gerald Lüttgen	10.1145/2931037.2931071
IPA: improving predictive analysis with pointer analysis.	Peng Liu 0010,Omer Tripp,Xiangyu Zhang 0001	10.1145/2931037.2931046
DroidRA: taming reflection to support whole-program analysis of Android apps.	Li Li 0029,Tegawendé F. Bissyandé,Damien Octeau,Jacques Klein	10.1145/2931037.2931044
Analyzing test completeness for dynamic languages.	Christoffer Quist Adamsen,Gianluca Mezzetti,Anders Møller	10.1145/2931037.2931059
Generating focused random tests using directed swarm testing.	Mohammad Amin Alipour,Alex Groce,Rahul Gopinath,Arpit Christi	10.1145/2931037.2931056
COSTOTest: a tool for building and running test harness for service-based component models (demo).	Pascal André,Jean-Marie Mottu,Gerson Sunyé	10.1145/2931037.2948704
Energy-aware test-suite minimization for Android apps.	Reyhaneh Jabbarvand Behrouz,Alireza Sadeghi,Hamid Bagheri,Sam Malek	10.1145/2931037.2931067
Mutation-aware fault prediction.	David Bowes,Tracy Hall,Mark Harman,Yue Jia 0001,Federica Sarro,Fan Wu 0009	10.1145/2931037.2931039
Zero-overhead profiling via EM emanations.	Robert Locke Callan,Farnaz Behrang,Alenka G. Zajic,Milos Prvulovic,Alessandro Orso	10.1145/2931037.2931065
Exploring regular expression usage and context in Python.	Carl Chapman,Kathryn T. Stolee	10.1145/2931037.2931073
PIT: a practical mutation testing tool for Java (demo).	Henry Coles,Thomas Laurent 0003,Christopher Henard,Mike Papadakis,Anthony Ventresque	10.1145/2931037.2948707
Specification of concretization and symbolization policies in symbolic execution.	Robin David,Sébastien Bardin,Josselin Feist,Laurent Mounier,Marie-Laure Potet,Thanh Dinh Ta,Jean-Yves Marion	10.1145/2931037.2931048
Monkey see, monkey do: effective generation of GUI tests with inferred macro events.	Markus Ermuth,Michael Pradel	10.1145/2931037.2931053
Verdict machinery: on the need to automatically make sense of test results.	Mikael Fagerström,Emre Emir Ismail,Grischa Liebel,Rohit Guliani,Fredrik Larsson,Karin Nordling,Eric Knauss,Patrizio Pelliccione	10.1145/2931037.2931064
Automatic generation of oracles for exceptional behaviors.	Alberto Goffi,Alessandra Gorla,Michael D. Ernst,Mauro Pezzè	10.1145/2931037.2931061
Automatically verifying and reproducing event-based races in Android apps.	Yongjian Hu,Iulian Neamtiu,Arash Alavi 0001	10.1145/2931037.2931069
Test oracle assessment and improvement.	Gunel Jahangirova,David Clark 0001,Mark Harman,Paolo Tonella	10.1145/2931037.2931062
Automated and effective testing of web services for XML injection attacks.	Sadeeq Jan,Cu D. Nguyen,Lionel C. Briand	10.1145/2931037.2931042
Practitioners&apos; expectations on automated fault localization.	Pavneet Singh Kochhar,Xin Xia 0001,David Lo 0001,Shanping Li	10.1145/2931037.2931051
A learning-to-rank based fault localization approach using likely invariants.	Tien-Duy B. Le,David Lo 0001,Claire Le Goues,Lars Grunske	10.1145/2931037.2931049
Sapienz: multi-objective automated testing for Android applications.	Ke Mao,Mark Harman,Yue Jia 0001	10.1145/2931037.2931054
ASTOR: a program repair library for Java (demo).	Matias Martinez,Martin Monperrus	10.1145/2931037.2948705
DEKANT: a static analysis tool that learns to detect web application vulnerabilities.	Ibéria Medeiros,Nuno Ferreira Neves,Miguel Correia 0001	10.1145/2931037.2931041
Binary code is not easy.	Xiaozhu Meng,Barton P. Miller	10.1145/2931037.2931047
Semantic modelling of Android malware for effective malware comprehension, detection, and classification.	Guozhu Meng,Yinxing Xue,Zhengzi Xu,Yang Liu 0003,Jie Zhang 0002,Annamalai Narayanan	10.1145/2931037.2931043
Efficient flow profiling for detecting performance bugs.	Rashmi Mudduluru,Murali Krishna Ramanathan	10.1145/2931037.2931066
Jolinar: analysing the energy footprint of software applications (demo).	Adel Noureddine,Syed Islam,Rabih Bashroush	10.1145/2931037.2948706
Automatic test case generation: what if test code quality matters?	Fabio Palomba,Annibale Panichella,Andy Zaidman,Rocco Oliveto,Andrea De Lucia	10.1145/2931037.2931057
Threats to the validity of mutation-based test assessment.	Mike Papadakis,Christopher Henard,Mark Harman,Yue Jia 0001,Yves Le Traon	10.1145/2931037.2931040
Testing stochastic software using pseudo-oracles.	Matthew Patrick,Andrew P. Craig,Nik J. Cunniffe,Matthew Parry,Christopher A. Gilligan	10.1145/2931037.2931063
EagerMerge: an optimistic technique for efficient points-to analysis.	Sudhir Samrit,Rupesh Nasre	10.1145/2931037.2931045
Efficient race detection in the presence of programmatic event loops.	Anirudh Santhiar,Shalini Kaleeswaran,Aditya Kanade	10.1145/2931037.2931068
Unveiling anomalies and their impact on software quality in model-based automotive software revisions with software metrics and domain experts.	Jan Schroeder,Christian Berger 0001,Miroslaw Staron,Thomas Herpel,Alessia Knauss	10.1145/2931037.2931060
Toward understanding compiler bugs in GCC and LLVM.	Chengnian Sun,Vu Le 0002,Qirun Zhang,Zhendong Su 0001	10.1145/2931037.2931074
CSNIPPEX: automated synthesis of compilable code snippets from Q&amp;A sites.	Valerio Terragni,Yepang Liu 0001,Shing-Chi Cheung	10.1145/2931037.2931058
Documenting database usages and schema constraints in database-centric applications.	Mario Linares Vásquez,Boyang Li 0002,Christopher Vendome,Denys Poshyvanyk	10.1145/2931037.2931072
ARROW: automated repair of races on client-side web pages.	Weihang Wang 0001,Yunhui Zheng,Peng Liu 0010,Lei Xu 0003,Xiangyu Zhang 0001,Patrick Eugster	10.1145/2931037.2931052
FSX: fine-grained incremental unit test generation for C/C++ programs.	Hiroaki Yoshida,Susumu Tokumoto,Mukul R. Prasad,Indradeep Ghosh,Tadahiro Uehara	10.1145/2931037.2931055
SyncProf: detecting, localizing, and optimizing synchronization bottlenecks.	Tingting Yu,Michael Pradel	10.1145/2931037.2931070
Optimal sanitization synthesis for web application vulnerability repair.	Fang Yu 0001,Ching-Yuan Shueh,Chun-Han Lin,Yu-Fang Chen 0001,Bow-Yaw Wang,Tevfik Bultan	10.1145/2931037.2931050
Predictive mutation testing.	Jie Zhang 0050,Ziyi Wang,Lingming Zhang 0001,Dan Hao 0001,Lei Zang,Shiyang Cheng 0002,Lu Zhang 0023	10.1145/2931037.2931038
Proceedings of the 25th International Symposium on Software Testing and Analysis, ISSTA 2016, Saarbrücken, Germany, July 18-20, 2016	Andreas Zeller,Abhik Roychoudhury	10.1145/2931037
