Automated Question Answering for Improved Understanding of Compliance Requirements: A Multi-Document Study.	Sallam Abualhaija,Chetan Arora 0002,Amin Sleimi,Lionel C. Briand	10.1109/RE54965.2022.00011
Retraining a BERT Model for Transfer Learning in Requirements Engineering: A Preliminary Study.	Muideen A. Ajagbe,Liping Zhao 0001	10.1109/RE54965.2022.00046
PyFoReL: A Domain-Specific Language for Formal Requirements in Temporal Logic.	Jacob Anderson,Mohammad Hekmatnejad,Georgios Fainekos	10.1109/RE54965.2022.00037
Towards a Decision Support Tool to Prescribe Recreation for Older Adults in Social Isolation (RxOSI).	Namrata Bagaria	10.1109/RE54965.2022.00028
CADE: The Missing Benchmark in Evaluating Dataset Requirements of AI-enabled Software.	Hamed Barzamini,Mona Rahimi	10.1109/RE54965.2022.00013
Legal Accountability as Software Quality: A U.S. Data Processing Perspective.	Travis D. Breaux,Thomas B. Norton	10.1109/RE54965.2022.00016
Requirements on Explanations: A Quality Framework for Explainability.	Larissa Chazette,Verena Klös,Florian Herzog,Kurt Schneider	10.1109/RE54965.2022.00019
Mining User Feedback For Software Engineering: Use Cases and Reference Architecture.	Jacek Dabrowski 0001,Emmanuel Letier,Anna Perini,Angelo Susi	10.1109/RE54965.2022.00017
AnnoteREI! A Tool for Transcribing and Annotating Requirements Elicitation Interviews.	Sourav Debnath,Santhiya Subramanian	10.1109/RE54965.2022.00031
What&apos;s Inside a Cluster of Software User Feedback: A Study of Characterisation Methods.	Peter Devine,James Tizard,Hechen Wang,Yun Sing Koh,Kelly Blincoe	10.1109/RE54965.2022.00023
Evidence-driven Data Requirements Engineering and Data Uncertainty Assessment of Machine Learning-based Safety-critical Systems.	Sangeeta Dey	10.1109/RE54965.2022.00027
A Live Extensible Ontology of Quality Factors for Textual Requirements.	Julian Frattini,Lloyd Montgomery,Jannik Fischbach,Michael Unterkalmsteiner,Daniel Méndez 0001,Davide Fucci	10.1109/RE54965.2022.00041
Developing A Privacy Risk Analysis Framework for Heterogeneous IoT Network.	Sanonda Datta Gupta	10.1109/RE54965.2022.00025
A Divide &amp; Concur Approach to Collaborative Goal Modeling with Merge in Early-RE.	Kathleen R. Hablutzel,Anisha Jain,Alicia M. Grubb	10.1109/RE54965.2022.00009
PrivacyStory: Tool Support for Extracting Privacy Requirements from User Stories.	Guntur Budi Herwanto,Gerald Quirchmayr,A Min Tjoa	10.1109/RE54965.2022.00036
RESAM: Requirements Elicitation and Specification for Deep-Learning Anomaly Models with Applications to UAV Flight Controllers.	Md Nafee Al Islam,Yihong Ma,Pedro Alarcon Granadeno,Nitesh V. Chawla,Jane Cleland-Huang	10.1109/RE54965.2022.00020
Creating Consistent Privacy Notices by Translating Code Segments into Privacy Captions.	Vijayanta Jain	10.1109/RE54965.2022.00024
Documenting Regulatory Requirements Decision-Making as a Compliance Concern.	Evelyn Kempe	10.1109/RE54965.2022.00026
The Benefits of Pre-Requirements Specification Traceability.	Julia Krause,Andreas Kaufmann,Dirk Riehle,Martin Junghans 0002	10.1109/RE54965.2022.00021
SafeWalk: a Simulation Tool Kit for Exploring Software Requirements in a Safety-Critical Product Line.	James I. Lathrop,Robyn R. Lutz,Cameron Brecount,Hugh D. Potter,Kathryn Rohlfing,Jesse Slater,Joshua Wallin	10.1109/RE54965.2022.00038
Telling Us Your Needs with Your Eyes.	Rongchen Li,Tong Li 0001	10.1109/RE54965.2022.00048
Narratives: the Unforeseen Influencer of Privacy Concerns.	Ze Shi Li,Manish Sihag,Nowshin Nawar Arony,Joao Bezerra Junior,Thanh Phan,Neil A. Ernst,Daniela E. Damian	10.1109/RE54965.2022.00018
Done is better than perfect: Iterative Adaptation via Multi-grained Requirement Relaxation.	Jialong Li,Kenji Tei	10.1109/RE54965.2022.00043
Automated Detection of Typed Links in Issue Trackers.	Clara Marie Lüders,Tim Pietz,Walid Maalej	10.1109/RE54965.2022.00010
Towards an automatic requirements classification in a new Spanish dataset.	María Isabel Limaylla Lunarejo,Nelly Condori-Fernández,Miguel R. Luaces	10.1109/RE54965.2022.00039
Hierarchical Assessment of Safety Requirements for Configurations of Autonomous Driving Systems.	Yixing Luo,Xiao-Yi Zhang 0005,Paolo Arcaini,Zhi Jin,Haiyan Zhao,Linjuan Zhang,Fuyuki Ishikawa	10.1109/RE54965.2022.00015
Requirements Engineering for Safety-Critical Molecular Programs.	Robyn R. Lutz	10.1109/RE54965.2022.00045
A Case Study of Building Shared Understanding of Non-Functional Requirements in a Remote Software Organization.	Laura Okpara,Colin M. Werner,Adam Murray,Daniela E. Damian	10.1109/RE54965.2022.00008
A Tool For Software Requirement Allocation Using Artificial Intelligence Planning.	Fernanda C. Pereira,Gerhard B. Neto,Luis F. de Lima,Fabiano Silva,Letícia M. Peres	10.1109/RE54965.2022.00032
Explainability in a Time of Socially Responsible Software.	Roxana Lisette Quintanilla Portugal,Luiz Marcio Cysneiros,Julio Cesar Sampaio do Prado Leite	10.1109/RE54965.2022.00044
DizSpec: Digitalization of Requirements Specification Documents to Automate Traceability and Impact Analysis.	Asha Rajbhoj,Padmalata Nistala,Vinay Kulkarni,Shivani Soni,Ajim Pathan	10.1109/RE54965.2022.00030
Enriching Vision Videos with Text: An Eye Tracking Study.	Melanie Schmedes,Maike Ahrens,Lukas Nagel,Kurt Schneider	10.1109/RE54965.2022.00014
A Box Analogy Technique (BoAT) for Agile-based Modelling of Business Processes.	Carlos Eduardo da Silva,Leisia Medeiros,Yan de Lima Justino,Eduardo Luiz Gomes	10.1109/RE54965.2022.00029
Teaching and learning Requirements Engineering concepts: Peer-review skills vs. problem solving skills.	Maria Spichkova	10.1109/RE54965.2022.00047
Back to the Roots: Linking User Stories to Requirements Elicitation Conversations.	Tjerk Spijkman,Fabiano Dalpiaz,Sjaak Brinkkemper	10.1109/RE54965.2022.00042
The Implications of &apos;Soft&apos; Requirements.	Alistair G. Sutcliffe,Pete Sawyer,Nelly Bencomo	10.1109/RE54965.2022.00022
NL2RT: A Tool to Translate Natural Language Text into Requirements Templates (RTs).	Saurabh Tiwari 0001,Parv Shah,Manish Khare	10.1109/RE54965.2022.00035
A Chatbot for the Elicitation of Contextual Information from User Feedback.	Robert Wolfinger,Farnaz Fotrousi,Walid Maalej	10.1109/RE54965.2022.00040
BiStar: A Template-Based iStar Modeling Tool Combining Graphical and Textual Modeling.	Haonan Xiong,Yunduo Wang,Tong Li 0001	10.1109/RE54965.2022.00034
Automatic Terminology Extraction and Ranking for Feature Modeling.	Jianzhang Zhang,Sisi Chen,Jinping Hua,Nan Niu,Chuang Liu 0001	10.1109/RE54965.2022.00012
A User-friendly Semi-automatic iStar Modeling Approach.	Qixiang Zhou,Tong Li 0001	10.1109/RE54965.2022.00033
30th IEEE International Requirements Engineering Conference, RE 2022, Melbourne, Australia, August 15-19, 2022		10.1109/RE54965.2022
