The hiphop virtual machine.	Keith Adams,Jason Evans,Bertrand Maher,Guilherme Ottoni,Andrew Paroski,Brett Simmers,Edwin Smith,Owen Yamauchi	10.1145/2660193.2660199
Confined gradual typing.	Esteban Allende,Johan Fabry,Ronald Garcia,Éric Tanter	10.1145/2660193.2660222
Refactoring Java generics by inferring wildcards, in practice.	John Altidor,Yannis Smaragdakis	10.1145/2660193.2660203
Foundations of path-dependent types.	Nada Amin,Tiark Rompf,Martin Odersky	10.1145/2660193.2660216
Determinacy in static analysis for jQuery.	Esben Andreasen,Anders Møller	10.1145/2660193.2660214
CheckCell: data debugging for spreadsheets.	Daniel W. Barowy,Dimitar Gochev,Emery D. Berger	10.1145/2660193.2660207
Tardis: affordable time-travel debugging in managed runtimes.	Earl T. Barr,Mark Marron	10.1145/2660193.2660209
Rate types for stream programs.	Thomas Bartenstein,Yu David Liu	10.1145/2660193.2660225
Phosphor: illuminating dynamic data flow in commodity jvms.	Jonathan Bell 0001,Gail E. Kaiser	10.1145/2660193.2660212
Symbolic execution of multithreaded programs from arbitrary program contexts.	Tom Bergan,Dan Grossman,Luis Ceze	10.1145/2660193.2660200
StreamJIT: a commensal compiler for high-performance stream programming.	Jeffrey Bosboom,Sumanaruban Rajadurai,Weng-Fai Wong,Saman P. Amarasinghe	10.1145/2660193.2660236
Static analysis for independent app developers.	Lucas Brutschy,Pietro Ferrara 0001,Peter Müller 0001	10.1145/2660193.2660219
Atlas: leveraging locks for non-volatile memory consistency.	Dhruva R. Chakrabarti,Hans-Juergen Boehm,Kumud Bhandari	10.1145/2660193.2660224
Continuously measuring critical section pressure with the free-lunch profiler.	Florian David,Gaël Thomas 0001,Julia Lawall,Gilles Muller	10.1145/2660193.2660210
Natural proofs for asynchronous programs using almost-synchronous reductions.	Ankush Desai,Pranav Garg 0001,P. Madhusudan	10.1145/2660193.2660211
Distributed REScala: an update algorithm for distributed reactive programming.	Joscha Drechsler,Guido Salvaneschi,Ragnar Mogk,Mira Mezini	10.1145/2660193.2660240
Checking correctness of TypeScript interfaces for JavaScript libraries.	Asger Feldthaus,Anders Møller	10.1145/2660193.2660215
Automated migration of build scripts using dynamic analysis and search-based refactoring.	Milos Gligoric 0001,Wolfram Schulte,Chandra Prasad,Danny van Velzen,Iman Narasamdya,Benjamin Livshits	10.1145/2660193.2660239
Region-based memory management for GPU programming languages: enabling rich data structures on a spartan host.	Eric Holk,Ryan Newton,Jeremy G. Siek,Andrew Lumsdaine	10.1145/2660193.2660244
Alembic: automatic locality extraction via migration.	Brandon Holt,Preston Briggs,Luis Ceze,Mark Oskin	10.1145/2660193.2660194
Using web corpus statistics for program analysis.	Chun-Hung Hsiao,Michael J. Cafarella,Satish Narayanasamy	10.1145/2660193.2660226
Staged parser combinators for efficient data processing.	Manohar Jonnalagedda,Thierry Coppey,Sandro Stucki,Tiark Rompf,Martin Odersky	10.1145/2660193.2660241
An experimental survey of energy management across the stack.	Melanie Kambadur,Martha A. Kim	10.1145/2660193.2660196
MIX10: compiling MATLAB to X10 for high performance.	Vineet Kumar,Laurie J. Hendren	10.1145/2660193.2660218
Flint: fixing linearizability violations.	Peng Liu 0010,Omer Tripp,Xiangyu Zhang 0001	10.1145/2660193.2660217
Chisel: reliability- and accuracy-aware optimization of approximate computational kernels.	Sasa Misailovic,Michael Carbin,Sara Achour,Zichao Qi,Martin C. Rinard	10.1145/2660193.2660231
i3QL: language-integrated live data views.	Ralf Mitschke,Sebastian Erdweg,Mirko Köhler 0001,Mira Mezini,Guido Salvaneschi	10.1145/2660193.2660242
Validation of memory accesses through symbolic analyses.	Henrique Nazaré,Izabela Maffra,Willer Santos,Leonardo Barbosa e Oliveira,Laure Gonnord,Fernando Magno Quintão Pereira	10.1145/2660193.2660205
Adaptive LL(*) parsing: the power of dynamic analysis.	Terence Parr,Sam Harwell,Kathleen Fisher	10.1145/2660193.2660202
Abstract semantic differencing via speculative correlation.	Nimrod Partush,Eran Yahav	10.1145/2660193.2660245
Finding minimum type error sources.	Zvonimir Pavlinovic,Tim King 0001,Thomas Wies	10.1145/2660193.2660230
Rubah: DSU for Java on a stock JVM.	Luís Pina,Luís Veiga,Michael W. Hicks	10.1145/2660193.2660220
Understanding energy behaviors of thread management constructs.	Gustavo Pinto 0001,Fernando Castor,Yu David Liu	10.1145/2660193.2660235
EventBreak: analyzing the responsiveness of user interfaces through performance-guided test generation.	Michael Pradel,Parker Schuh,George C. Necula,Koushik Sen	10.1145/2660193.2660233
Translating imperative code to MapReduce.	Cosmin Radoi,Stephen J. Fink,Rodric M. Rabbah,Manu Sridharan	10.1145/2660193.2660228
From object algebras to attribute grammars.	Tillmann Rendel,Jonathan Immanuel Brachthäuser,Klaus Ostermann	10.1145/2660193.2660237
Bounded exhaustive test input generation from hybrid invariants.	Nicolás Rosner,Valeria S. Bengolea,Pablo Ponzio,Shadi Abdul Khalek,Nazareno Aguirre,Marcelo F. Frias,Sarfraz Khurshid	10.1145/2660193.2660232
Multithreaded test synthesis for deadlock detection.	Malavika Samak,Murali Krishna Ramanathan	10.1145/2660193.2660238
Fast conservative garbage collection.	Rifat Shahriyar,Stephen M. Blackburn,Kathryn S. McKinley	10.1145/2660193.2660198
Statistical debugging for real-world performance problems.	Linhai Song,Shan Lu 0001	10.1145/2660193.2660234
Fast splittable pseudorandom number generators.	Guy L. Steele Jr.,Doug Lea,Christine H. Flood	10.1145/2660193.2660195
SurveyMan: programming and automatically debugging surveys.	Emma Tosch,Emery D. Berger	10.1145/2660193.2660206
GPS: navigating weak memory with ghosts, protocols, and separation.	Aaron Turon,Viktor Vafeiadis,Derek Dreyer	10.1145/2660193.2660243
Smten with satisfiability-based search.	Richard Uhler,Nirav Dave	10.1145/2660193.2660208
Late data layout: unifying data representation transformations.	Vlad Ureche,Eugene Burmako,Martin Odersky	10.1145/2660193.2660197
ASPIRE: exploiting asynchronous parallelism in iterative algorithms using a relaxed consistency based DSM.	Keval Vora,Sai Charan Koduru,Rajiv Gupta 0001	10.1145/2660193.2660227
Compiler verification meets cross-language linking via data abstraction.	Peng Wang 0048,Santiago Cuellar,Adam Chlipala	10.1145/2660193.2660201
Cybertron: pushing the limit on I/O reduction in data-parallel programs.	Tian Xiao,Zhenyu Guo,Hucheng Zhou,Jiaxing Zhang,Xu Zhao,Chencheng Ye,Xi Wang 0005,Wei Lin 0016,Wenguang Chen,Lidong Zhou	10.1145/2660193.2660204
Accelerating iterators in optimizing AST interpreters.	Wei Zhang 0059,Per Larsen,Stefan Brunthaler,Michael Franz	10.1145/2660193.2660223
Efficient subcubic alias analysis for C.	Qirun Zhang,Xiao Xiao 0003,Charles Zhang,Hao Yuan,Zhendong Su 0001	10.1145/2660193.2660213
Call sequence prediction through probabilistic calling automata.	Zhijia Zhao 0001,Bo Wu 0002,Mingzhou Zhou,Yufei Ding,Jianhua Sun,Xipeng Shen,Youfeng Wu	10.1145/2660193.2660221
Space-efficient multi-versioning for input-adaptive feedback-driven program optimizations.	Mingzhou Zhou,Xipeng Shen,Yaoqing Gao,Graham Yiu	10.1145/2660193.2660229
Proceedings of the 2014 ACM International Conference on Object Oriented Programming Systems Languages &amp; Applications, OOPSLA 2014, part of SPLASH 2014, Portland, OR, USA, October 20-24, 2014	Andrew P. Black,Todd D. Millstein	10.1145/2660193
