uiCA: accurate throughput prediction of basic blocks on recent intel microarchitectures.	Andreas Abel 0002,Jan Reineke 0001	10.1145/3524059.3532396
Bring orders into uncertainty: enabling efficient uncertain graph processing via novel path sampling on multi-accelerator systems.	Heng Zhang 0005,Lingda Li,Hang Liu 0001,Donglin Zhuang,Rui Liu 0002,Chengying Huan,Shuang Song,Dingwen Tao,Yongchao Liu,Charles He,Yanjun Wu,Shuaiwen Leon Song	10.1145/3524059.3532379
CEAZ: accelerating parallel I/O via hardware-algorithm co-designed adaptive lossy compression.	Chengming Zhang 0006,Sian Jin,Tong Geng,Jiannan Tian,Ang Li 0006,Dingwen Tao	10.1145/3524059.3532362
Clairvoyant: a log-based transformer-decoder for failure prediction in large-scale systems.	Khalid Ayedh Alharthi,Arshad Jhumka,Sheng Di,Franck Cappello	10.1145/3524059.3532374
Parallel K-clique counting on GPUs.	Mohammad Almasri,Izzat El Hajj,Rakesh Nagi,Jinjun Xiong,Wen-Mei Hwu	10.1145/3524059.3532382
Preparing for performance analysis at exascale.	Jonathon M. Anderson,Yumeng Liu,John M. Mellor-Crummey	10.1145/3524059.3532397
Lifting C semantics for dataflow optimization.	Alexandru Calotoiu,Tal Ben-Nun,Grzegorz Kwasniewski,Johannes de Fine Licht,Timo Schneider,Philipp Schaad,Torsten Hoefler	10.1145/3524059.3532389
SparseLNR: accelerating sparse tensor computations using loop nest restructuring.	Adhitha Dias,Kirshanthan Sundararajah,Charitha Saumya,Milind Kulkarni 0001	10.1145/3524059.3532386
Handling heavy-tailed input of transformer inference on GPUs.	Jiangsu Du,Jiazhi Jiang,Yang You 0001,Dan Huang,Yutong Lu	10.1145/3524059.3532372
MASTIFF: structure-aware minimum spanning tree/forest.	Mohsen Koohi Esfahani,Peter Kilpatrick,Hans Vandierendonck	10.1145/3524059.3532365
Optimized MPI collective algorithms for dragonfly topology.	Guangnan Feng,Dezun Dong,Yutong Lu	10.1145/3524059.3532380
Calipers: a criticality-aware framework for modeling processor performance.	Hossein Golestani,Rathijit Sen,Vinson Young,Gagan Gupta	10.1145/3524059.3532390
GAPS: GPU-acceleration of PDE solvers for wave simulation.	Bagus Hanindhito,Dimitrios Gourounas,Arash Fathi,Dimitar Trenev,Andreas Gerstlauer,Lizy K. John	10.1145/3524059.3532373
MegTaiChi: dynamic tensor-based memory management optimization for DNN training.	Zhongzhe Hu,Junmin Xiao,Zheye Deng,Mingyi Li,Kewei Zhang,Xiaoyang Zhang,Ke Meng,Ninghui Sun,Guangming Tan	10.1145/3524059.3532394
Efficient exact K-nearest neighbor graph construction for billion-scale datasets using GPUs with tensor cores.	Zhuoran Ji,Cho-Li Wang	10.1145/3524059.3532368
High throughput multidimensional tridiagonal system solvers on FPGAs.	Kamalavasan Kamalakkannan,Gihan R. Mudalige,István Z. Reguly,Suhaib A. Fahmy	10.1145/3524059.3532371
VICO: demand-driven verification for improving compiler optimizations.	Sharjeel Khan,Bodhisatwa Chatterjee,Santosh Pande	10.1145/3524059.3532393
SnuHPL: high performance LINPACK for heterogeneous GPUs.	Jinpyo Kim,Hyungdal Kwon,Jintaek Kang,Jihwan Park,Seungwook Lee,Jaejin Lee	10.1145/3524059.3532370
Cloak: tolerating non-volatile cache read latency.	Apostolos Kokolis,Namrata Mantri,Shrikanth Ganapathy,Josep Torrellas,John Kalamatianos	10.1145/3524059.3532381
Towards low-latency I/O services for mixed workloads using ultra-low latency SSDs.	Mingzhe Liu,Haikun Liu,Chencheng Ye,Xiaofei Liao,Hai Jin 0001,Yu Zhang 0027,Ran Zheng,Liting Hu	10.1145/3524059.3532378
Toward accelerated stencil computation by adapting tensor core unit on GPU.	Xiaoyan Liu,Yi Liu 0013,Hailong Yang,Jianjin Liao,Mingzhen Li,Zhongzhi Luan,Depei Qian	10.1145/3524059.3532392
Seamless optimization of the GEMM kernel for task-based programming models.	Arthur Francisco Lorenzon,Sandro Matheus V. N. Marques,Antoni C. Navarro,Vicenç Beltran 0001	10.1145/3524059.3532385
Efficiently emulating high-bitwidth computation with low-bitwidth hardware.	Zixuan Ma,Haojie Wang,Guanyu Feng,Chen Zhang,Lei Xie,Jiaao He,Shengqi Chen 0001,Jidong Zhai	10.1145/3524059.3532377
AnySeq/GPU: a novel approach for faster sequence alignment on GPUs.	André Müller,Bertil Schmidt,Richard Membarth,Roland Leißa,Sebastian Hack	10.1145/3524059.3532376
Efficient, out-of-memory sparse MTTKRP on massively parallel architectures.	Andy Nguyen,Ahmed E. Helal,Fabio Checconi,Jan Laukemann,Jesmin Jahan Tithi,Yongseok Soh,Teresa M. Ranadive,Fabrizio Petrini,Jee W. Choi	10.1145/3524059.3532363
SnuQS: scaling quantum circuit simulation using storage devices.	Daeyoung Park,Heehoon Kim,Jinpyo Kim,Taehyun Kim,Jaejin Lee	10.1145/3524059.3532375
Dynamic memory management in massively parallel systems: a case on GPUs.	Minh Pham,Hao Li 0071,Yongke Yuan,Chengcheng Mou,Kandethody Ramachandran,Zichen Xu 0001,Yicheng Tu	10.1145/3524059.3532387
A data-centric optimization framework for machine learning.	Oliver Rausch,Tal Ben-Nun,Nikoli Dryden,Andrei Ivanov,Shigang Li 0002,Torsten Hoefler	10.1145/3524059.3532364
Performance-detective: automatic deduction of cheap and accurate performance models.	Larissa Schmid,Marcin Copik,Alexandru Calotoiu,Dominik Werle,Andreas Reiter,Michael Selzer,Anne Koziolek,Torsten Hoefler	10.1145/3524059.3532391
KrakenOnMem: a memristor-augmented HW/SW framework for taxonomic profiling.	Taha Shahroodi,Mahdi Zahedi,Abhairaj Singh,Stephan Wong,Said Hamdioui	10.1145/3524059.3532367
Beyond time complexity: data movement complexity analysis for matrix multiplication.	Wesley Smith,Aidan Goldfarb,Chen Ding 0001	10.1145/3524059.3532395
Rethinking graph data placement for graph neural network training on multiple GPUs.	Shihui Song,Peng Jiang 0004	10.1145/3524059.3532384
ASAP: automatic synthesis of area-efficient and precision-aware CGRAs.	Cheng Tan 0002,Thierry Tambe,Jeff Jun Zhang,Bo Fang,Tong Geng,Gu-Yeon Wei,David Brooks 0001,Antonino Tumeo,Ganesh Gopalakrishnan,Ang Li 0006	10.1145/3524059.3532359
Fast-track cache: a huge racetrack memory L1 data cache.	Hugo Tárrega,Alejandro Valero,Vicente Lorente,Salvador Petit,Julio Sahuquillo	10.1145/3524059.3532383
Software-defined floating-point number formats and their application to graph processing.	Hans Vandierendonck	10.1145/3524059.3532360
Dense dynamic blocks: optimizing SpMM for processors with vector and matrix units using machine learning techniques.	Serif Yesil,José E. Moreira,Josep Torrellas	10.1145/3524059.3532369
LITE: a low-cost practical inter-operable GPU TEE.	Ardhi Wiratama Baskara Yudha,Jake Meyer,Shougang Yuan,Huiyang Zhou,Yan Solihin	10.1145/3524059.3532361
PAME: precision-aware multi-exit DNN serving for reducing latencies of batched inferences.	Shulai Zhang,Weihao Cui,Quan Chen 0002,Zhengnian Zhang,Yue Guan,Jingwen Leng,Chao Li 0009,Minyi Guo	10.1145/3524059.3532366
Low overhead and context sensitive profiling of CPU-accelerated applications.	Keren Zhou 0001,Jonathon M. Anderson,Xiaozhu Meng,John M. Mellor-Crummey	10.1145/3524059.3532388
ICS &apos;22: 2022 International Conference on Supercomputing, Virtual Event, June 28 - 30, 2022	Lawrence Rauchwerger,Kirk W. Cameron,Dimitrios S. Nikolopoulos,Dionisios N. Pnevmatikatos	10.1145/3524059
