Relational String Abstract Domains.	Vincenzo Arceri,Martina Olliaro,Agostino Cortesi,Pietro Ferrara 0001	10.1007/978-3-030-94583-1_2
Flavors of Sequential Information Flow.	Ezio Bartocci,Thomas Ferrère,Thomas A. Henzinger,Dejan Nickovic,Ana Oliveira da Costa	10.1007/978-3-030-94583-1_1
Fanoos: Multi-resolution, Multi-strength, Interactive Explanations for Learned Systems.	David Bayani,Stefan Mitsch	10.1007/978-3-030-94583-1_3
Loop Verification with Invariants and Contracts.	Gidon Ernst	10.1007/978-3-030-94583-1_4
EPMC Gets Knowledge in Multi-agent Systems.	Chen Fu,Ernst Moritz Hahn,Yong Li 0031,Sven Schewe,Meng Sun 0002,Andrea Turrini,Lijun Zhang 0001	10.1007/978-3-030-94583-1_5
High Assurance Software for Financial Regulation and Business Platforms.	Stephen Goldbaum,Attila Mihály,Tosha Ellison,Earl T. Barr,Mark Marron	10.1007/978-3-030-94583-1_6
Gradient-Descent for Randomized Controllers Under Partial Observability.	Linus Heck,Jip Spel,Sebastian Junges,Joshua Moerman,Joost-Pieter Katoen	10.1007/978-3-030-94583-1_7
Automata-Driven Partial Order Reduction and Guided Search for LTL Model Checking.	Peter Gjøl Jensen,Jirí Srba,Nikolaj Jensen Ulrik,Simon Mejlby Virenfeldt	10.1007/978-3-030-94583-1_8
Verifying Pufferfish Privacy in Hidden Markov Models.	Depeng Liu,Bow-Yaw Wang,Lijun Zhang 0001	10.1007/978-3-030-94583-1_9
A Flow-Insensitive-Complete Program Representation.	Solène Mirliaz,David Pichardie	10.1007/978-3-030-94583-1_10
Lightweight Shape Analysis Based on Physical Types.	Olivier Nicole,Matthieu Lemerre,Xavier Rival	10.1007/978-3-030-94583-1_11
Fast Three-Valued Abstract Bit-Vector Arithmetic.	Jan Onderka,Stefan Ratschan	10.1007/978-3-030-94583-1_12
Satisfiability and Synthesis Modulo Oracles.	Elizabeth Polgreen,Andrew Reynolds 0001,Sanjit A. Seshia	10.1007/978-3-030-94583-1_13
Bisimulations for Neural Network Reduction.	Pavithra Prabhakar	10.1007/978-3-030-94583-1_14
NP Satisfiability for Arrays as Powers.	Rodrigo Raya,Viktor Kuncak	10.1007/978-3-030-94583-1_15
STAMINA 2.0: Improving Scalability of Infinite-State Stochastic Model Checking.	Riley Roberts,Thakur Neupane,Lukas Buecherl,Chris J. Myers,Zhen Zhang 0006	10.1007/978-3-030-94583-1_16
Generalized Arrays for Stainless Frames.	Georg Stefan Schmid,Viktor Kuncak	10.1007/978-3-030-94583-1_17
Making PROGRESS in Property Directed Reachability.	Tobias Seufert,Christoph Scholl 0001,Arun Chandrasekharan,Sven Reimer,Tobias Welp	10.1007/978-3-030-94583-1_18
Scaling Up Livelock Verification for Network-on-Chip Routing Algorithms.	Landon Taylor,Zhen Zhang 0006	10.1007/978-3-030-94583-1_19
Stateful Dynamic Partial Order Reduction for Model Checking Event-Driven Applications that Do Not Terminate.	Rahmadi Trimananda,Weiyu Luo,Brian Demsky,Guoqing Harry Xu	10.1007/978-3-030-94583-1_20
Verifying Solidity Smart Contracts via Communication Abstraction in SmartACE.	Scott Wesley,Maria Christakis,Jorge A. Navas,Richard J. Trefler,Valentin Wüstholz,Arie Gurfinkel	10.1007/978-3-030-94583-1_21
Out of Control: Reducing Probabilistic Models by Control-State Elimination.	Tobias Winkler,Johannes Lehmann 0001,Joost-Pieter Katoen	10.1007/978-3-030-94583-1_22
Mixed Semantics Guided Layered Bounded Reachability Analysis of Compositional Linear Hybrid Automata.	Yuming Wu,Lei Bu,Jiawan Wang,Xinyue Ren,Wen Xiong,Xuandong Li	10.1007/978-3-030-94583-1_23
Bit-Precise Reasoning via Int-Blasting.	Yoni Zohar,Ahmed Irfan,Makai Mann,Aina Niemetz,Andres Nötzli,Mathias Preiner,Andrew Reynolds 0001,Clark W. Barrett,Cesare Tinelli	10.1007/978-3-030-94583-1_24
Verification, Model Checking, and Abstract Interpretation - 23rd International Conference, VMCAI 2022, Philadelphia, PA, USA, January 16-18, 2022, Proceedings	Bernd Finkbeiner,Thomas Wies	10.1007/978-3-030-94583-1
